true_act	pred_act	true_turn	pred_turn
offer	offer	Shawnus; can give..wood or sheep; Offer	[Offer], Pippa: I can give you a wheat in exchange for some ore.
refusal	counteroffer	ztime; sorry; Refusal	[Counteroffer], Alex: I can give you clay for some wood.
refusal	offer	ztime; i spent it; Refusal	[Offer], Emily: I can give you 2 wheat for 1 ore.
refusal	other	somdechn; Sore; Refusal	[Other], Sara: How did you spend it?
refusal	other	somdechn; ry..; Refusal	[Other], somdechn: I have plenty of wood to trade if anyone is interested.
offer	offer	ztime; I'll give an ore; Offer	[Offer], Maya: I have extra clay, would you be willing to trade for some wheat?
refusal	counteroffer	somdechn; Nop; Refusal	[Counteroffer], Alex: I can give you two wood for that ore.
refusal	counteroffer	ztime; have none; Refusal	[Counteroffer], [other player]: How about I give you wheat for ore instead?
refusal	offer	Shawnus; need wheat; Refusal	[Offer], Emily: I can offer you 1 sheep for 2 ore.
offer	other	ztime; anyone want wood?; Offer	[Other], Player 1: Let's keep an eye on the robber's movements and strategize accordingly.
refusal	other	Shawnus; nope; Refusal	[Other], Emily: I agree, it seems like we are all evenly matched so far.
refusal	offer	somdechn; nop; Refusal	[Offer], Sarah: I'll give you 2 wood for 1 sheep.
offer	other	somdechn; I can give wood for Wheat.; Offer	[Other], Marissa: Stop laughing, Shawnus. The game is getting intense.
offer	counteroffer	somdechn; or clay; Offer	[Counteroffer], player 2: I can give you wheat for ore.
offer	offer	somdechn; Clay would be better.; Offer	[Offer], Emily: I can offer you 2 wood for 1 ore.
refusal	offer	ztime; unless it's wood.. I can't help; Refusal	[Offer], player2: I have extra clay, would you be willing to trade for some wheat?
refusal	other	somdechn; Nooo.; Refusal	Other, Emily: Is anyone willing to trade ore?
offer	other	somdechn; Wood for clay?; Offer	[Other], Player 1: Yeah, the dice rolls can be pretty unpredictable sometimes. But it keeps the game interesting!
refusal	other	ztime; sorry...; Refusal	[Other], Emily: That robber is causing chaos on the board!

counteroffer	offer	Shawnus; for?; Counteroffer	[Offer], Player B: I can trade you some clay for wheat.
refusal	offer	somdechn; Got none..; Refusal	[Offer], Grace: I'll give you 1 wood for 1 brick.
refusal	other	Shawnus; no; Refusal	Other, Shawnus: I just realized I have enough resources to build a settlement.
offer	counteroffer	ztime; wood; Offer	[Counteroffer], Jordan: I can give you 2 wheat for 1 ore.
offer	other	ztime; ore; Offer	[Other], Marie: Is it just me or are the ore tiles rolling high numbers today?
refusal	offer	Shawnus; not got any wood; Refusal	[Offer], Alice: wheat for ore
offer	accept	somdechn; giving out wood for wheat...; Offer	[Accept], Emily: Sure, go ahead and take your turn.
refusal	counteroffer	ztime; sorry don't need wood; Refusal	[Counteroffer], Sarah: I can give you wheat for ore instead.
counteroffer	other	ztime; do you have clay?; Counteroffer	[Other], somdechn: I'm really low on ore, does anyone have extra they'd be willing to trade?
counteroffer	other	ztime; for wheat?; Counteroffer	[Other], Alex: I don't have any clay, but I have plenty of wheat.
refusal	accept	somdechn; No...; Refusal	[Accept], Alice: Sure, I can trade you wheat for ore.
offer	offer	somdechn; Ore for wheat Ore for wheat; Offer	[Offer], Emma: I'll give you 1 wood for 1 wheat.
refusal	accept	ztime; no thanks; Refusal	[Accept], Mia: I accept the trade, I have plenty of wheat to spare.
refusal	counteroffer	Shawnus; nope; Refusal	Counteroffer, Alex: I can offer you 1 ore for 1 wheat.
offer	counteroffer	Shawnus; want..clay?; Offer	Counteroffer, Rachel: I can give you wheat in exchange for ore.
accept	other	ztime; yer.. I need clay..; Accept	[Other], Alex: Just built a settlement. Hoping to get some wheat to start expanding.
counteroffer	offer	ztime; can give wheat; Counteroffer	[Offer], Amy: I can give you clay in exchange for sheep.
accept	offer	Shawnus; k; Accept	[Offer], Player 1: I can give you wood for the wheat.
refusal	offer	WoodnSheep; can't help, sorry; Refusal	[Offer], Emily: I can give you wood in exchange for ore.
refusal	other	Shawnus; Not spare sorry; Refusal	[Other], ClaynSheep: No worries, we all make mistakes in the game sometimes.
counteroffer	offer	ztime; for...?; Counteroffer	[Offer], SheepnWheat: I can give you some clay in exchange for wheat.
offer	offer	WoodnSheep; I have wheat I have wheat; Offer	[Offer], Alex: I'll give you 2 sheep for 1 wheat.
counteroffer	offer	ztime; wood?; Counteroffer	[Offer], ClaynOre: I can offer you clay and ore for your wheat.
counteroffer	offer	WoodnSheep; maybe sheep maybe sheep; Counteroffer	[Offer], Player A: ore for wood?
accept	refusal	ztime; ok; Accept	[Refusal], OreClay: I can't do that trade, but I could offer you some ore for wood instead.
refusal	offer	WoodnSheep; no wood sorry; Refusal	[Offer], Sarah: I'll trade you 2 wood for 1 clay.
accept	other	ztime; ok 1 sheep; Accept	[Other], OrePlayer: Don't worry about it, mistakes happen. Let's keep playing.
accept	offer	ztime; for 1 clay; Accept	[Offer], Alex: I'll give you 1 wood for your sheep.
offer	other	ztime; anyone want clay.. I'm after wood..; Offer	[Other], ClaynWheat: Don't worry, luck can change quickly in this game. Just keep strategizing and you'll be back in it.
offer	offer	ztime; or sheep; Offer	[Offer], Alice: I can give you wood in exchange for some ore.
accept	offer	Shawnus; I have spare sheep; Accept	[Offer], Alex: I can give you ore for wheat.
accept	offer	ztime; ok; Accept	[Offer], Emma: I could trade you some wheat for your sheep.
refusal	accept	ztime; no sorry.. you just stole my sheep; Refusal	[Accept], ClaynWheat: Sure, I'll trade you sheep for clay.
offer	offer	WoodnSheep; shawnus, any clay for me?; Offer	[Offer], Emily: I have an abundance of wheat, anyone willing to trade for some ore?
counteroffer	other	Shawnus; For anything but sheep?; Counteroffer	[Other], shawnus: Sorry, I'm running low on clay myself.
counteroffer	accept	WoodnSheep; wheat?; Counteroffer	[Accept], Liam: I can give you ore for wheat.
accept	accept	Shawnus; sure; Accept	[Accept], ClaynWheat: Sure, I'll trade you wheat for wood.
offer	other	Shawnus; anyone want to trade sheep for wheat?; Offer	[Other], ClaynWheat: Do you think we should focus on expanding our settlements or upgrading our existing ones?
refusal	offer	WoodnSheep; my resources all got stolen...; Refusal	[Offer], Sarah: I can give you wheat in exchange for ore.
offer	other	Shawnus; need wheat; Offer	[Other], ClaynWheat: That robber pawn is really causing trouble for everyone.
accept	offer	ztime; ok I can give 1 wheat; Accept	[Offer], Emma: I can give you wheat in exchange for ore.
offer	other	WoodnSheep; Sooo, anyone want sheep?; Offer	[Other], Player A: I hate when the robber pawn comes into play, it always messes up my strategy.
refusal	offer	ztime; no thanks; Refusal	[Offer], WheatnOre: I'll trade wheat for sheep.
offer	offer	WoodnSheep; I'm open to suggestions as to what for; Offer	[Offer], Emily: I'm willing to trade 1 ore for 1 clay.
counteroffer	offer	ztime; sheep; Counteroffer	[Offer], ClaynWheat: I can offer you 1 clay for 1 wood.
refusal	other	Shawnus; dont want it... it's dirty now; Refusal	[Other], ClaynWheat: I can't believe how many ore resources are being generated this game.
accept	offer	Shawnus; ok, after you move the dude; Accept	[Offer], Emily: I can give you clay in exchange for wheat.
counteroffer	other	Shawnus; clay for wheat clay for wheat; Counteroffer	[Other], Emma: The robber has to be moved to a new land because the sum of the dice was 7.
offer	other	ztime; anyone (Shawnus) want wheat?; Offer	[Other], Emma: Are you okay, Shawnus? Maybe you should take your turn.
accept	offer	Shawnus; yes; Accept	[Offer], Shawnus: I'll trade you wood for wheat.
counteroffer	other	Shawnus; for clay?; Counteroffer	[Other], Shawnus: I just bought a development card which might come in handy later.
accept	accept	ztime; yep; Accept	[Accept], Lauren: Sure, I can give you some clay for wheat.
accept	offer	Shawnus; k; Accept	Offer, xplayer: I'll give you 1 ore for 2 wheat.
refusal	counteroffer	ztime; no sorry; Refusal	[Counteroffer], Emma: I have clay, would you be willing to trade some wood for it?
refusal	offer	WoodnSheep; no sorry; Refusal	[Offer], Emily: I can trade you 1 wheat for 1 ore.
offer	accept	Shawnus; Wolfie?; Offer	[Accept], ClaynWheat: No worries, it happens.
offer	other	WoodnSheep; I'd like a clay; Offer	[Other], Player 1: Let's see, who has the most wood and wheat right now?
offer	other	WoodnSheep; I have a wheat?; Offer	[Other], Jenna: Do you need any resources to help you out, Shawnus?
refusal	other	Shawnus; i just have wood; Refusal	[Other], ClaynOre: I have plenty of clay and ore, anyone interested in trading for wheat?
offer	other	WoodnSheep; Clay anyone?; Offer	[Other], Player 1: Is it just me, or are we running low on wood resources?
refusal	other	Shawnus; i need clay..; Refusal	Other, Maria: Have you noticed how scarce ore has been this game?
offer	other	ztime; anyone want a clean sheep?; Offer	[Other], Mia: That's okay, accidents happen. Let's move on and keep playing.
offer	offer	ztime; I'm after wood; Offer	[Offer], ellen: I'll trade you a wood for that sheep.
refusal	offer	WoodnSheep; no ta; Refusal	Offer, Sarah: I'll give you 1 wood for 1 ore.
accept	offer	Shawnus; ok; Accept	[Offer], Emily: I have an extra wood, would anyone be willing to trade for some wheat?
refusal	counteroffer	ztime; sorry no can do; Refusal	[Counteroffer], WheatnOre: I can give you wheat for clay.
refusal	other	Shawnus; no clay; Refusal	[Other], Lila: What's your strategy for getting more diverse resources?
refusal	offer	Shawnus; defininetly not; Refusal	[Offer], Emily: I can trade you wood for ore.
refusal	offer	ztime; na; Refusal	[Offer], Emma: I'll take your wood if you're willing to trade for some clay.
refusal	counteroffer	WoodnSheep; nah; Refusal	[Counteroffer], Sarah: I can give you 2 wheat for 1 ore.
offer	other	WoodnSheep; any clay?; Offer	Other, Riley: It's always good to free up some space in your hand.
refusal	offer	ztime; nope soz; Refusal	[Offer], ClaynWheat: I can give you clay for some wheat.
refusal	other	Shawnus; nope; Refusal	[Other], Alex: Let's focus on expanding our settlements for now, we can trade resources later.
offer	other	WoodnSheep; any sheep? any sheep? any sheep?; Offer	[Other], Lisa: Does anyone have any wood to trade?
counteroffer	accept	Shawnus; dont say wood..; Counteroffer	[Accept], Alex: I accept your offer of 1 wood for 1 sheep.
offer	other	WoodnSheep; woo... woo...; Offer	Other, Jenna: I think Shawnus might have a lot of wood to offer, that's why he doesn't want to hear it.
refusal	other	Shawnus; :P no thanks; Refusal	Other, Emily: I think we should all be careful not to let one player get too far ahead in resources. We should strategize together to balance things out.
refusal	other	ztime; no ta; Refusal	[Other], Shawnus: Let's see, who's turn is it next?
offer	other	WoodnSheep; In return for wo*d?; Offer	[Other], Emily: I think I need to build a road to expand my settlement.
refusal	accept	ztime; errr... no sorry; Refusal	[Accept], SheepnWheat: Sure, I can give you sheep for wood.
counteroffer	other	ztime; anything else?; Counteroffer	[Other], Player 1: It's okay, mistakes happen. Let's keep playing.
refusal	other	WoodnSheep; I have nothing else; Refusal	[Other], Jamie: Maybe you don't have enough wood resource cards to build settlements. Don't worry, we can trade if you need some.
refusal	refusal	ztime; no sorry; Refusal	[Refusal], WheatnClay: No thanks, I need my clay for building structures.
refusal	accept	Shawnus; i dont have any; Refusal	[Accept], Emma: No problem, what do you need?
refusal	accept	WoodnSheep; no thanks; Refusal	[Accept], Alice: I'll trade you a wheat for some clay.
offer	accept	ztime; I'm after sheep; Offer	Accept, Gwen: I'll trade you 1 ore for 2 wheat.
accept	other	Shawnus; ok; Accept	[Other], Emma: I have plenty of wheat, anyone interested in trading for sheep?
offer	offer	ztime; anyone want ore?; Offer	[Offer], Emily: I will give you 2 sheep for 1 clay.
offer	offer	ztime; I'm after wood; Offer	[Offer], Emily: I'll trade you wood for ore.
refusal	offer	WoodnSheep; no thanks; Refusal	[Offer], Samantha: I have extra wood, would you be willing to trade for some ore?
refusal	other	Shawnus; nope; Refusal	[Other], ClaynWheat: Does anyone want to trade for ore or clay?
offer	other	WoodnSheep; I have wood...; Offer	Other, Eric: What trend are you noticing, ztime?
refusal	offer	Shawnus; me too; Refusal	[Offer], ClaynWheat: I have clay, would you be willing to trade for wood?
offer	other	WoodnSheep; clay?; Offer	Other, Player B: Let's see, I have an extra sheep I could trade if anyone's interested.
refusal	counteroffer	ztime; no can do..; Refusal	[Counteroffer], OrePlayer: wheat for clay?
refusal	counteroffer	Shawnus; got none; Refusal	[Counteroffer], Player B: I can give you 1 wheat for 1 ore.
offer	offer	WoodnSheep; no one has wheat?; Offer	[Offer], Emma: I can give you some wheat in exchange for ore.
refusal	accept	ztime; no; Refusal	[Accept], ClaynWheat: I have wheat, what do you need in exchange?
refusal	offer	Shawnus; nope; Refusal	Offer, Emily: I have extra wheat, anyone interested in trading for wood?
refusal	counteroffer	ztime; sorry; Refusal	[Counteroffer], OrePlayer: I can give you ore for sheep.
refusal	refusal	Shawnus; nope sorry; Refusal	[Refusal], Emma: No worries, we all make mistakes.
refusal	offer	Shawnus; nope; Refusal	[Offer], Player 2: I can trade you some ore for wood.
refusal	other	WoodnSheep; no thanks; Refusal	[Other], Lily: Can anyone spare some ore?
offer	other	ztime; anyone want wood?; Offer	Other, Emma: I remember that time when we all had a shortage of wheat and sheep, and everyone was scrambling to make trades. [type of utterance], [Player name]:[utterance]
refusal	offer	WoodnSheep; no thanks; Refusal	[Offer], Sarah: I could trade you some wheat for wood.
offer	other	ztime; err. anyone want ore?; Offer	[Other], ClaynWheat: How did you manage to get caught out?
offer	other	ztime; I'm after wheat; Offer	[Other], Alex: I have extra wood if anyone is interested.
refusal	other	Shawnus; no thanks; Refusal	[Other], Player 2: I have some wheat to trade, what are you offering in return?
counteroffer	other	WoodnSheep; can you chuck in a peice of wood?; Counteroffer	[Other], Jenna: No problem, just happy to be playing with you all.
counteroffer	accept	WoodnSheep; as well that is; Counteroffer	[Accept], OreNC: sure, I can give you a piece of wood for a sheep.
accept	other	ztime; yer; Accept	[Other], ClaynWheat: I think I need to focus on expanding my settlements towards more resource-producing tiles.
counteroffer	offer	ztime; 1 wood and 1 ore.. for a wheat..; Counteroffer	[Offer], Player 1: I'll give you 2 ore for 1 wheat.
accept	other	WoodnSheep; cool; Accept	[Other], Emma: I don't have any wheat, but I could offer you a sheep for that wood and ore.
counteroffer	offer	Shawnus; do you have a sheep to trade?; Counteroffer	[Offer], Anna: I can offer you some ore in exchange for sheep, if you're interested.
refusal	counteroffer	ztime; sorry; Refusal	[Counteroffer], Alice: I can give you wheat in exchange for ore.
refusal	other	WoodnSheep; sorry; Refusal	[Other], Player 1: It's okay, don't worry about it.
refusal	offer	ztime; srry can't help; Refusal	[Offer], OrePlayer: I can trade you a sheep for some ore.
refusal	other	Shawnus; nope sorry; Refusal	[Other], Mike: Can anyone trade ore for wheat?
offer	other	WoodnSheep; wood?; Offer	[Other], Alex: Waiting to see what resources will be produced this turn before making any trades.
offer	offer	WoodnSheep; or maybe sheep?; Offer	[Offer], ClaynWheat: clay for sheep?
counteroffer	offer	ztime; sheep; Counteroffer	[Offer], ClaynOre: I can give you clay in exchange for some ore.
accept	offer	ztime; ok; Accept	[Offer], Emma: I can give you wheat in exchange for some sheep.
offer	other	Shawnus; a wood or a clay?; Offer	[Other], Sarah: I think we should all start focusing on expanding our settlements to get more resources.
refusal	offer	ztime; no sorry; Refusal	[Offer], Emily: I can offer you a clay for a wood.
offer	accept	ztime; for ore?; Offer	[Accept], Chris: I could use some clay, thanks for the offer.
offer	other	ztime; or wheat?; Offer	[Other], Maya: Is it just me, or does it seem like Shawnus is having a lucky streak with those dice rolls?
refusal	offer	Shawnus; i dont have enough sorry; Refusal	Offer, Alice: I'll give you 2 wood for 1 ore.
offer	offer	catanstrophe; anyone have brick?; Offer	[Offer], Sarah: I'll trade you 2 sheep for 1 wood.
refusal	other	zorburt; no brick.; Refusal	[Other], raefbrisbin: How are your wheat and sheep production going?
refusal	other	raefbrisbin; nope; Refusal	[Other], player1: Does anyone have any extra wood they'd be willing to trade?
accept	refusal	raefbrisbin; yup; Accept	[Refusal], player2: Sorry, I don't have any ore to trade right now.
accept	offer	zorburt; i hav an ore; Accept	[Offer], raefbrisbin: I'll give you 2 sheep for 1 wheat.
accept	offer	raefbrisbin; 4; Accept	[Offer], Mike: I'll trade you a wheat for that ore.
offer	offer	catanstrophe; will trade a sheep or wood or wheat; Offer	[Offer], Ashley: 1 wheat for 1 ore.
counteroffer	counteroffer	raefbrisbin; wood; Counteroffer	[Counteroffer], player2: I'll give you ore for a sheep.
counteroffer	other	zorburt; i'll take wood or wheat for an ore; Counteroffer	[Other], Emily: I need wheat to build a settlement.
counteroffer	counteroffer	raefbrisbin; for 2; Counteroffer	[Counteroffer], Jandara: I can give you wheat for that ore.
counteroffer	offer	catanstrophe; ok will trade wood hold on let me figure this out; Counteroffer	[Offer], sophiasmith: 1 wheat for 1 ore
counteroffer	other	catanstrophe; can you do 1 for 1?; Counteroffer	Other, Luna: Is anyone willing to trade ore for wheat?
accept	counteroffer	zorburt; i can!; Accept	[Counteroffer], Marina: I can do 2 wood for 1 sheep.
counteroffer	counteroffer	raefbrisbin; i'll give 2 i'll give 2; Counteroffer	Counteroffer, Jake: I'll give you 2 wheat for 1 ore.
counteroffer	counteroffer	raefbrisbin; wood; Counteroffer	[Counteroffer], raef: I can give you 1 wheat for 1 ore and 1 wood.
accept	offer	catanstrophe; oksounds good; Accept	[Offer], raefbrisbin: ore
offer	accept	zorburt; anyone?; Offer	[Accept], Michael: I'll trade you a clay for a sheep.
offer	offer	zorburt; sorry not clay. wood.; Offer	[Offer], Lucy: I can give you some ore in exchange for wheat.
refusal	offer	raefbrisbin; nay; Refusal	[Offer], Mia: clay.
refusal	offer	catanstrophe; no i am looking for clay as well no i am looking for clay as well; Refusal	[Offer], alexmg: I'll trade you 2 sheep for 1 wood.
offer	other	zorburt; sorry, essentially i need wood. i mistyped.; Offer	[Other], raefbrisbin: I can't seem to get any ore this game!
counteroffer	other	catanstrophe; ok i have one to trade for one clay; Counteroffer	[Other], Alice: Don't worry, it happens to all of us.
refusal	counteroffer	zorburt; bah i need my clay. thanks tho; Refusal	[Counteroffer], player_2: I can give you one clay for one wheat.
refusal	offer	raefbrisbin; none; Refusal	[Offer], player1: I have wheat and ore, anyone interested in trading?
refusal	offer	zorburt; none.; Refusal	[Offer], Sarah: I have an extra wheat, anyone willing to trade for wood?
offer	other	catanstrophe; does anyone have sheep? does anyone have sheep?; Offer	Other, player1: I think we're all being pretty cautious with our trades in this game.
counteroffer	offer	Ghettoette; have sheep for ore or brick; Counteroffer	[Offer], player1: I have sheep, what are you offering in return?
counteroffer	offer	zorburt; i'll trade a sheep for brick.; Counteroffer	[Offer], Alex: I'll give you ore for sheep.
accept	counteroffer	Ghettoette; ok; Accept	[Counteroffer], Lily: I can give you a brick for a wheat.
offer	other	catanstrophe; i can give one wood for one sheep?; Offer	[Other], John: Let's remember that the robber is currently on the ore hex, so none of us can receive any ore until it's moved.
accept	other	zorburt; yeah i can do that. sorry i got cofused earlier with ghettoette.; Accept	[Other], John: It's your turn now, just roll the dice and let's see what resources we get.
counteroffer	other	zorburt; catanstrophe: i can give you a sheep for your wood.; Counteroffer	[Other], Ghettoette: What happened that confused you?
accept	accept	catanstrophe; ok zorburt i will gie you one wood for one sheep; Accept	[Accept], catanstrophe: Sure, I'll trade you a wood for a sheep.
accept	refusal	zorburt; excellent.; Accept	[Refusal], Sarah: Sorry, I need wood for my next build.
offer	counteroffer	catanstrophe; anyone have wheat; Offer	[Counteroffer], Emily: I'll give you 2 ore for 1 wheat.
refusal	other	zorburt; no; Refusal	[Other], Sarah: I have some wheat, what are you offering in return?
refusal	accept	Ghettoette; sorry; Refusal	[Accept], Alice: Sure, I'll take that trade.
refusal	other	raefbrisbin; sorry; Refusal	[Other], Michael: No worries, Ghettoette. Let's focus on our next moves.
offer	other	catanstrophe; brick?; Offer	[Other], Sofia: It's okay, just remember to move the robber pawn!
refusal	offer	raefbrisbin; nope; Refusal	[Offer], player1: I can trade you a brick for some wheat.
refusal	offer	Ghettoette; nope; Refusal	Offer, jessicasmith: I'll give you 2 wheat for 1 ore.
refusal	other	zorburt; no; Refusal	[Other], Tom: Does anyone have any wood to trade?
refusal	other	catanstrophe; no 10s rolled; Refusal	[Other], Alice: I think zorburt might be referring to the fact that they need a specific resource for their next move.
accept	counteroffer	catanstrophe; here; Accept	[Counteroffer], jennysmith: I can give you ore for clay instead.
accept	offer	catanstrophe; i can do it; Accept	[Offer], player1: I have extra wheat, anyone interested in trading for ore?
offer	other	raefbrisbin; need 2 ore?; Offer	[Other], player 1: Are you referring to building a settlement or upgrading to a city?
counteroffer	counteroffer	catanstrophe; i can give you ore; Counteroffer	[Counteroffer], raefbrisbin: I will give you 1 ore for 1 wheat.
offer	accept	raefbrisbin; want 2 ore; Offer	[Accept], player B: sure, I can give you some ore for it.
counteroffer	offer	catanstrophe; i can do 1 for 1; Counteroffer	[Offer], sara: I can give you 1 ore for 1 wheat.
counteroffer	counteroffer	catanstrophe; i give one ore for one wheat; Counteroffer	[Counteroffer], Alex: How about 2 wood for 1 ore?
counteroffer	refusal	catanstrophe; or i could do for 2-for-2; Counteroffer	[Refusal], player1: No thanks, I need ore more than wheat right now.
offer	other	catanstrophe; raef - are you looking to trade some of that wheat?; Offer	[Other], Player 1: I know, it's crazy how often they're rolling.
refusal	other	raefbrisbin; I'm ok right now; Refusal	[Other], raefbrisbin: I should pay more attention to the dice rolls next time.
offer	other	catanstrophe; i can give an ore or a wood; Offer	[Other], player1: Can anyone spare some wood?
refusal	other	raefbrisbin; evryone needs clay evryone needs clay; Refusal	[Other], player1: Do you need anything specific in return for the ore or wood?
offer	counteroffer	Ghettoette; anyone have ore to trade me for wheat or sheep?; Offer	[Counteroffer], raefbrisbin: I'll trade you 2 wheat for 1 ore.
refusal	offer	zorburt; no; Refusal	[Offer], Max: I have ore, I'll trade you for wheat.
counteroffer	other	catanstrophe; i'll give one ore for 2 wheat; Counteroffer	[Other], Sarah: Are you looking to trade for anything specific, zorburt?
accept	other	Ghettoette; ok; Accept	[Other], raefbrisbin: I can't believe I rolled a 7 again.
accept	other	catanstrophe; ok sounds good; Accept	Other, Alice: It looks like we're all set then. Let's continue with the game.
counteroffer	offer	zorburt; i can give you a wood.; Counteroffer	[Offer], Jack: I can give you wood in exchange for wheat.
counteroffer	other	zorburt; for a wheat?; Counteroffer	[Other], player1: I know, I've been really lucky with the dice rolls today.
accept	counteroffer	Ghettoette; ok; Accept	[Counteroffer], Alice: I can give you wood for that wheat.
counteroffer	accept	zorburt; 2 wheats? 2 wheats?; Counteroffer	[Accept], Ryan: Sure, I can give you 2 wheat for 1 ore.
refusal	counteroffer	Ghettoette; can't do; Refusal	[Counteroffer], Susan: 1 ore for 1 wheat?
refusal	offer	Ghettoette; nope; Refusal	[Offer], player1: I have brick, what are you offering in return?
refusal	other	zorburt; no; Refusal	[Other], John: I think we should focus on expanding to new areas of the board to increase our resource production.
offer	other	zorburt; does anyone want to give me a wood?; Offer	[Other], Jenna: I think someone may have a monopoly on ores.
accept	refusal	raefbrisbin; sure; Accept	[Refusal], player1: Sorry zorburt, I need my wood for my own structures.
counteroffer	accept	catanstrophe; for brick?; Counteroffer	[Accept], raefbrisbin: Great, let's trade 1 ore for 1 wheat.
refusal	counteroffer	zorburt; i don't have any brick.; Refusal	[Counteroffer], player1: I can give you wheat for brick.
offer	offer	zorburt; ok raef. i can give you an ore or a sheep. i can give you an ore or a sheep.; Offer	[Offer], Lisa: I can trade you a brick for a wheat.
refusal	counteroffer	catanstrophe; ok i can't trade this time around then; Refusal	[Counteroffer], Emily: I'll trade you a wheat for that ore.
counteroffer	offer	raefbrisbin; ore; Counteroffer	[Offer], player1: I can offer you some wheat in exchange for ore.
accept	offer	zorburt; OK; Accept	[Offer], emily_94: I have wheat, anyone interested in trading for ore?
accept	counteroffer	Ghettoette; sure; Accept	[Counteroffer], Zoe: No, but I can give you wheat for wood, if you're interested.
offer	accept	raefbrisbin; want 1-2 sheep; Offer	[Accept], Liam: Sure, I could use some wood in exchange for wheat.
