true_act	pred_act	true_turn	pred_turn
refusal	counteroffer	somdechn; got no wood; Refusal	Counteroffer
counteroffer	offer	ztime; ok clay then; Counteroffer	[Offer]
accept	counteroffer	somdechn; ok.; Accept	Counteroffer
offer	offer	WoodnSheep; anyone got clay?; Offer	[Offer]
accept	offer	ztime; yep; Accept	[Offer]
offer	counteroffer	WoodnSheep; what would you like?; Offer	Counteroffer
counteroffer	offer	ztime; wood?; Counteroffer	[Offer]
offer	offer	WoodnSheep; I could offer wheat; Offer	[Offer]
counteroffer	offer	ztime; two wheat?; Counteroffer	[Offer]
counteroffer	counteroffer	WoodnSheep; mmm 1 wood, 1 wheat for 2 clay?; Counteroffer	Counteroffer
accept	counteroffer	ztime; OK; Accept	Counteroffer
offer	offer	somdechn; Ok I can give Sheep for Clay; Offer	[Offer]
refusal	counteroffer	ztime; sorry; Refusal	Counteroffer
refusal	offer	Shawnus; none sorry; Refusal	[Offer]
offer	offer	somdechn; 2 Sheep for Clay Ztime; Offer	[Offer]
refusal	offer	ztime; sorry; Refusal	[Offer]
refusal	offer	Shawnus; not got any; Refusal	[Offer]
offer	counteroffer	ztime; anyone want wood... I'm after ore or clay; Offer	Counteroffer
refusal	counteroffer	somdechn; No thanks; Refusal	Counteroffer
offer	counteroffer	ztime; how about I give you a wood for a sheep?; Offer	Counteroffer
refusal	counteroffer	Shawnus; no thank you; Refusal	[Counteroffer]
refusal	counteroffer	somdechn; Nah...; Refusal	Counteroffer
offer	offer	ztime; anyone want wheat?; Offer	[Offer]
accept	offer	somdechn; Yes please; Accept	[Offer]
offer	counteroffer	ztime; I'm after wood; Offer	Counteroffer
offer	counteroffer	ztime; or sheep...; Offer	Counteroffer
offer	offer	ztime; which do you want?; Offer	[Offer]
counteroffer	offer	somdechn; I can give you ore; Counteroffer	[Offer]
accept	counteroffer	ztime; ore.. ok...; Accept	Counteroffer
offer	offer	ztime; anyone want to sell sheep?; Offer	[Offer]
offer	counteroffer	ztime; I can give wheat..; Offer	Counteroffer
refusal	counteroffer	Shawnus; not got any :(; Refusal	Counteroffer
counteroffer	counteroffer	somdechn; How about clay?; Counteroffer	Counteroffer
offer	offer	ztime; 2 wheat... 2 wheat...; Offer	[Offer]
refusal	counteroffer	somdechn; I want clay...; Refusal	Counteroffer
refusal	offer	ztime; sorry..; Refusal	[Offer]
offer	offer	somdechn; I can give wood or Wheat for 2 Sheeps.; Offer	[Offer]
refusal	offer	ztime; sorry...; Refusal	[Offer]
refusal	counteroffer	Shawnus; i need sheep..not got any. Ztime has monopolised livestock; Refusal	Counteroffer
refusal	offer	ztime; I don't have any sheep...; Refusal	[Offer]
offer	counteroffer	somdechn; What do you need Shawnus; Offer	Counteroffer
counteroffer	counteroffer	Shawnus; sheep; Counteroffer	Counteroffer
offer	counteroffer	somdechn; What can you give?; Offer	Counteroffer
counteroffer	offer	Shawnus; wood or ore; Counteroffer	[Offer]
accept	offer	somdechn; Wood would be nice; Accept	[Offer]
offer	offer	ztime; anyone want to give me wood.. I'll give wheat...; Offer	[Offer]
counteroffer	counteroffer	somdechn; Give me clay and we might have a deal.; Counteroffer	Counteroffer
refusal	counteroffer	ztime; sorry; Refusal	Counteroffer
offer	counteroffer	ztime; how about 2 wheat.. for 1 wood? how about 2 wheat.. for 1 wood?; Offer	[Counteroffer]
refusal	counteroffer	somdechn; Sorry...; Refusal	[Counteroffer]
offer	refusal	ztime; how about 1 ore and 1 wheat for wood; Offer	[Refusal]
refusal	counteroffer	somdechn; Still can't do it..; Refusal	Counteroffer
counteroffer	offer	Shawnus; you want 1 wood?; Counteroffer	[Offer]
offer	counteroffer	Shawnus; so..can anyone trade me a sheep for wood?; Offer	Counteroffer
refusal	counteroffer	ztime; sorry... nz is the place to go!; Refusal	Counteroffer
refusal	counteroffer	somdechn; No sheep here mate.. No sheep here mate..; Refusal	Counteroffer
offer	offer	Shawnus; still no sheep out there is there?; Offer	[Offer]
refusal	offer	ztime; nope.. sheep free here; Refusal	[Offer]
offer	offer	ztime; anyone want wood...; Offer	[Offer]
offer	counteroffer	ztime; I'm after clay; Offer	Counteroffer
refusal	offer	Shawnus; got no clay; Refusal	[Offer]
refusal	offer	somdechn; No clay from me my friend.; Refusal	[Offer]
offer	counteroffer	somdechn; I can give wood for ore or wheat.; Offer	Counteroffer
refusal	counteroffer	ztime; sorry... trying to ship wood out..; Refusal	Counteroffer
counteroffer	offer	Shawnus; 1 for 1, ok; Counteroffer	[Offer]
accept	offer	somdechn; yep; Accept	[Offer]
accept	offer	Shawnus; ok; Accept	[Offer]
offer	offer	somdechn; What can you give? What can you give?; Offer	[Offer]
counteroffer	counteroffer	Shawnus; wheat; Counteroffer	Counteroffer
offer	counteroffer	Shawnus; want to trade a wood for sheep?; Offer	Counteroffer
refusal	counteroffer	somdechn; no thanks.; Refusal	[Counteroffer]
refusal	counteroffer	ztime; sorry.. still no sheep here; Refusal	Counteroffer
offer	offer	Shawnus; want some more wood? want some more wood?; Offer	[Offer]
counteroffer	offer	somdechn; Need 2 wood for that though..; Counteroffer	[Offer]
accept	offer	Shawnus; ok; Accept	[Offer]
offer	offer	ztime; anyone have clay?; Offer	[Offer]
offer	offer	ztime; I can give wood; Offer	[Offer]
refusal	offer	somdechn; No....; Refusal	[Offer]
refusal	refusal	Shawnus; nope; Refusal	[Refusal]
offer	offer	ztime; wheat; Offer	[Offer]
offer	offer	ztime; I give wheat; Offer	[Offer]
refusal	offer	somdechn; Nop; Refusal	[Offer]
offer	counteroffer	Shawnus; have a clay now, anyone have a wood?; Offer	Counteroffer
accept	offer	ztime; yep; Accept	[Offer]
accept	counteroffer	ztime; I have wood; Accept	Counteroffer
counteroffer	offer	ztime; 1 for 1; Counteroffer	[Offer]
accept	counteroffer	somdechn; Yes please; Accept	Counteroffer
offer	offer	somdechn; Wood for Ore... anyone?; Offer	[Offer]
refusal	other	Shawnus; nope, sorry; Refusal	[Other]
offer	offer	ztime; ok anyone want wheat?; Offer	[Offer]
refusal	offer	Shawnus; nope; Refusal	[Offer]
accept	offer	somdechn; Yes; Accept	[Offer]
counteroffer	offer	somdechn; I can give you wood.; Counteroffer	[Offer]
accept	offer	ztime; OK.. cool.. for 1 wheat?; Accept	[Offer]
counteroffer	accept	somdechn; and an ore.. :); Counteroffer	[Accept]
counteroffer	offer	ztime; err.. don't have ore..; Counteroffer	[Offer]
offer	counteroffer	somdechn; I need either ore or clay.. I can give wood or sheep.; Offer	Counteroffer
refusal	counteroffer	Shawnus; no spare sorry; Refusal	Counteroffer
counteroffer	counteroffer	ztime; I'll do 1 ore for 1 wood and 1 sheep; Counteroffer	Counteroffer
refusal	offer	somdechn; Hmmm nah...; Refusal	[Offer]
offer	counteroffer	somdechn; Do you want sheep??; Offer	Counteroffer
accept	offer	ztime; Ok.. for 1 wheat; Accept	[Offer]
counteroffer	counteroffer	somdechn; 1 Wood maybe; Counteroffer	Counteroffer
refusal	counteroffer	ztime; empty on wood; Refusal	Counteroffer
counteroffer	offer	somdechn; what about ore what about ore; Counteroffer	[Offer]
counteroffer	counteroffer	ztime; for?; Counteroffer	Counteroffer
refusal	refusal	somdechn; Nevermind; Refusal	[Refusal]
offer	other	somdechn; I need wood, clay or ore,  I can give Sheep; Offer	[Other] 
accept	counteroffer	Shawnus; i can trade wood; Accept	Counteroffer
refusal	counteroffer	ztime; just spent it all sorry; Refusal	Counteroffer
offer	offer	somdechn; 1 sheep for 1 wood?; Offer	[Offer]
counteroffer	counteroffer	Shawnus; 2 sheep 1 wood; Counteroffer	Counteroffer
refusal	counteroffer	ztime; sorry empty; Refusal	Counteroffer
offer	offer	ztime; anyone want wheat?; Offer	[Offer]
refusal	offer	Shawnus; nope :(; Refusal	[Offer]
refusal	offer	somdechn; Nop; Refusal	[Offer]
offer	offer	somdechn; Wheat -> Ore??; Offer	[Offer]
offer	offer	somdechn; Yep/...; Offer	[Offer]
refusal	offer	ztime; sorry; Refusal	[Offer]
offer	refusal	somdechn; Or clay?; Offer	[Refusal]
refusal	counteroffer	Shawnus; none sorry; Refusal	Counteroffer
refusal	offer	ztime; sorry; Refusal	[Offer]
offer	offer	ztime; anyone want wood?; Offer	[Offer]
refusal	counteroffer	Shawnus; nope; Refusal	Counteroffer
offer	offer	Shawnus; anyone have ore to trade?; Offer	[Offer]
refusal	counteroffer	ztime; no sorry; Refusal	Counteroffer
refusal	refusal	somdechn; No.,..; Refusal	[Refusal]
offer	counteroffer	Shawnus; or..a clay foy wheat or wood..; Offer	Counteroffer
counteroffer	offer	ztime; i can give wheat; Counteroffer	[Offer]
refusal	offer	somdechn; No clay here iether. No clay here iether.; Refusal	[Offer]
refusal	counteroffer	ztime; ahh sorry .. no clay ahh sorry .. no clay; Refusal	[Counteroffer]
offer	counteroffer	ztime; anyone want wheat?; Offer	Counteroffer
refusal	offer	somdechn; No thanks; Refusal	[Offer]
counteroffer	offer	Shawnus; for?; Counteroffer	[Offer]
offer	offer	ztime; sheep or ore or clay; Offer	[Offer]
refusal	offer	Shawnus; hahaha dont have them; Refusal	[Offer]
offer	offer	somdechn; Wood -> Sheep; Offer	[Offer]
offer	offer	somdechn; I need sheep here..; Offer	[Offer]
refusal	offer	ztime; sorry; Refusal	[Offer]
refusal	counteroffer	Shawnus; sorry, no sheep on my lands; Refusal	Counteroffer
refusal	offer	ztime; sheep-free; Refusal	[Offer]
offer	counteroffer	somdechn; 2 woods for anything but not wheat. 2 woods for anything but not wheat.; Offer	Counteroffer
refusal	offer	ztime; sorry; Refusal	[Offer]
counteroffer	offer	ztime; unless you'd accept a wood in return??; Counteroffer	[Offer]
counteroffer	counteroffer	Shawnus; hahaha a ore?; Counteroffer	Counteroffer
accept	counteroffer	somdechn; Sure thing..; Accept	[Counteroffer]
accept	counteroffer	ztime; great... set it up!; Accept	Counteroffer
counteroffer	offer	somdechn; ore would be good; Counteroffer	[Offer]
refusal	offer	Shawnus; you sound desperate and i can't so no so no; Refusal	[Offer]
offer	counteroffer	somdechn; 2 woods for 1 ore?; Offer	Counteroffer
refusal	counteroffer	ztime; sorry; Refusal	Counteroffer
refusal	offer	Shawnus; nope sorry; Refusal	[Offer]
offer	offer	Shawnus; anyone want to give me wheat for sheep?; Offer	[Offer]
refusal	offer	ztime; sorry; Refusal	[Offer]
refusal	offer	somdechn; I got sheep; Refusal	[Offer]
offer	offer	somdechn; Shawnus I got Sheep.. still want to trand?; Offer	[Offer]
counteroffer	offer	Shawnus; i need wheat; Counteroffer	[Offer]
offer	offer	somdechn; Who whats Sheep?; Offer	[Offer]
refusal	other	Shawnus; nope; Refusal	[Offer] 
refusal	other	ztime; not really... when you get l road; Refusal	[Other]
offer	offer	ztime; anyone want wheat?; Offer	[Offer]
counteroffer	counteroffer	Shawnus; for?; Counteroffer	Counteroffer
offer	counteroffer	ztime; sheep?; Offer	Counteroffer
counteroffer	counteroffer	somdechn; Sheep?; Counteroffer	Counteroffer
accept	refusal	Shawnus; k; Accept	[Refusal]
offer	offer	ztime; yer sheep; Offer	[Offer]
counteroffer	offer	somdechn; 2 Wheat; Counteroffer	[Offer]
counteroffer	offer	Shawnus; 1!; Counteroffer	[Offer]
offer	offer	ztime; anyone else want wheat?; Offer	[Offer]
accept	offer	somdechn; ok me; Accept	[Offer]
counteroffer	offer	somdechn; What do you want? Sheep.; Counteroffer	[Offer]
counteroffer	counteroffer	ztime; do you have clay or wood?; Counteroffer	Counteroffer
counteroffer	offer	somdechn; I do have wood. for 2 Wheats...; Counteroffer	[Offer]
accept	refusal	ztime; OK; Accept	[Refusal]
offer	other	Shawnus; i need a wheat; Offer	[Other]
offer	offer	Shawnus; can give..wood or sheep; Offer	[Offer]
refusal	counteroffer	ztime; sorry; Refusal	Counteroffer
refusal	offer	ztime; i spent it; Refusal	[Offer]
refusal	offer	somdechn; Sore; Refusal	[Offer]
refusal	counteroffer	somdechn; ry..; Refusal	[Counteroffer]
offer	offer	ztime; I'm after clay...; Offer	[Offer]
offer	offer	ztime; I'll give an ore; Offer	[Offer]
refusal	counteroffer	somdechn; Nop; Refusal	Counteroffer
offer	offer	somdechn; I have give wood for wheat.; Offer	[Offer]
refusal	refusal	ztime; have none; Refusal	[Refusal]
refusal	refusal	Shawnus; need wheat; Refusal	[Refusal]
offer	offer	ztime; anyone want wood?; Offer	[Offer]
refusal	offer	Shawnus; nope; Refusal	[Offer]
refusal	counteroffer	somdechn; nop; Refusal	Counteroffer
offer	counteroffer	somdechn; I can give wood for Wheat.; Offer	Counteroffer
offer	offer	somdechn; or clay; Offer	[Offer]
offer	counteroffer	somdechn; Clay would be better.; Offer	Counteroffer
refusal	counteroffer	ztime; unless it's wood.. I can't help; Refusal	[Counteroffer]
refusal	counteroffer	somdechn; Nooo.; Refusal	[Counteroffer]
offer	other	somdechn; Wood for clay?; Offer	[Offer] 
refusal	offer	ztime; sorry...; Refusal	[Offer]
offer	offer	ztime; anyone want to give me clay...; Offer	[Offer]
counteroffer	offer	Shawnus; for?; Counteroffer	[Offer]
refusal	counteroffer	somdechn; Got none..; Refusal	Counteroffer
refusal	counteroffer	Shawnus; no; Refusal	Counteroffer
offer	counteroffer	ztime; wood; Offer	Counteroffer
offer	offer	ztime; ore; Offer	[Offer]
refusal	counteroffer	Shawnus; not got any wood; Refusal	Counteroffer
offer	offer	somdechn; giving out wood for wheat...; Offer	[Offer]
refusal	offer	ztime; sorry don't need wood; Refusal	[Offer]
counteroffer	other	ztime; do you have clay?; Counteroffer	[Other]
counteroffer	offer	ztime; for wheat?; Counteroffer	[Offer]
refusal	counteroffer	somdechn; No...; Refusal	Counteroffer
offer	refusal	somdechn; Ore for wheat Ore for wheat; Offer	[Refusal]
refusal	counteroffer	ztime; no thanks; Refusal	Counteroffer
refusal	offer	Shawnus; nope; Refusal	[Offer]
offer	offer	Shawnus; need wheat; Offer	[Offer]
offer	counteroffer	Shawnus; want..clay?; Offer	Counteroffer
accept	counteroffer	ztime; yer.. I need clay..; Accept	Counteroffer
counteroffer	counteroffer	ztime; can give wheat; Counteroffer	Counteroffer
accept	offer	Shawnus; k; Accept	[Offer]
offer	offer	ztime; anyone want wheat? I'm after wood; Offer	[Offer]
refusal	offer	WoodnSheep; can't help, sorry; Refusal	[Offer]
refusal	offer	Shawnus; Not spare sorry; Refusal	[Offer]
offer	offer	WoodnSheep; I'd like some clay; Offer	[Offer]
counteroffer	counteroffer	ztime; for...?; Counteroffer	Counteroffer
offer	counteroffer	WoodnSheep; I have wheat I have wheat; Offer	Counteroffer
counteroffer	offer	ztime; wood?; Counteroffer	[Offer]
counteroffer	offer	WoodnSheep; maybe sheep maybe sheep; Counteroffer	[Offer]
accept	offer	ztime; ok; Accept	[Offer]
refusal	offer	WoodnSheep; no wood sorry; Refusal	[Offer]
accept	offer	ztime; ok 1 sheep; Accept	[Offer]
accept	offer	ztime; for 1 clay; Accept	[Offer]
offer	offer	ztime; anyone want clay.. I'm after wood..; Offer	[Offer]
offer	counteroffer	ztime; or sheep; Offer	Counteroffer
accept	counteroffer	Shawnus; I have spare sheep; Accept	[Counteroffer]
accept	counteroffer	ztime; ok; Accept	Counteroffer
offer	offer	WoodnSheep; er sheep for clay attempt 2?; Offer	[Offer]
refusal	offer	ztime; no sorry.. you just stole my sheep; Refusal	[Offer]
offer	offer	WoodnSheep; shawnus, any clay for me?; Offer	[Offer]
counteroffer	counteroffer	Shawnus; For anything but sheep?; Counteroffer	Counteroffer
counteroffer	offer	WoodnSheep; wheat?; Counteroffer	[Offer]
accept	counteroffer	Shawnus; sure; Accept	Counteroffer
offer	offer	Shawnus; anyone want to trade sheep for wheat?; Offer	[Offer]
refusal	counteroffer	WoodnSheep; my resources all got stolen...; Refusal	Counteroffer
offer	offer	Shawnus; need wheat; Offer	[Offer]
accept	counteroffer	ztime; ok I can give 1 wheat; Accept	Counteroffer
offer	offer	WoodnSheep; Sooo, anyone want sheep?; Offer	[Offer]
refusal	offer	ztime; no thanks; Refusal	[Offer]
offer	counteroffer	WoodnSheep; I'm open to suggestions as to what for; Offer	Counteroffer
counteroffer	offer	ztime; sheep; Counteroffer	[Offer]
refusal	offer	Shawnus; dont want it... it's dirty now; Refusal	[Offer]
offer	refusal	ztime; anyone have ore? I'm giving away a sheep; Offer	[Refusal]
offer	offer	ztime; anyone want wheat? I'm after clay.. or wood; Offer	[Offer]
accept	counteroffer	Shawnus; ok, after you move the dude; Accept	Counteroffer
counteroffer	offer	Shawnus; clay for wheat clay for wheat; Counteroffer	[Offer]
offer	offer	ztime; anyone (Shawnus) want wheat?; Offer	[Offer]
accept	offer	Shawnus; yes; Accept	[Offer]
counteroffer	offer	Shawnus; for clay?; Counteroffer	[Offer]
accept	counteroffer	ztime; yep; Accept	Counteroffer
accept	counteroffer	Shawnus; k; Accept	Counteroffer
offer	counteroffer	Shawnus; anyone need wood?; Offer	[Counteroffer]
refusal	offer	ztime; no sorry; Refusal	[Offer]
refusal	other	WoodnSheep; no sorry; Refusal	[Other]
offer	offer	Shawnus; Wolfie?; Offer	[Offer]
offer	offer	WoodnSheep; I'd like a clay; Offer	[Offer]
offer	offer	WoodnSheep; I have a wheat?; Offer	[Offer]
refusal	offer	Shawnus; i just have wood; Refusal	[Offer]
offer	offer	WoodnSheep; Clay anyone?; Offer	[Offer]
refusal	other	Shawnus; i need clay..; Refusal	[Other]
offer	offer	ztime; anyone want a clean sheep?; Offer	[Offer]
offer	offer	ztime; I'm after wood; Offer	[Offer]
refusal	counteroffer	WoodnSheep; no ta; Refusal	Counteroffer
accept	offer	Shawnus; ok; Accept	[Offer]
offer	other	WoodnSheep; Clay for me?; Offer	[Other]
refusal	counteroffer	ztime; sorry no can do; Refusal	Counteroffer
refusal	offer	Shawnus; no clay; Refusal	[Offer]
offer	counteroffer	ztime; anyone after wood...; Offer	Counteroffer
refusal	offer	Shawnus; defininetly not; Refusal	[Offer]
offer	offer	Shawnus; so no one wants wood right?; Offer	[Offer]
refusal	offer	ztime; na; Refusal	[Offer]
refusal	offer	WoodnSheep; nah; Refusal	[Offer]
offer	offer	WoodnSheep; any clay?; Offer	[Offer]
refusal	offer	ztime; nope soz; Refusal	[Offer]
refusal	offer	Shawnus; nope; Refusal	[Offer]
offer	offer	WoodnSheep; any sheep? any sheep? any sheep?; Offer	[Offer]
counteroffer	counteroffer	Shawnus; dont say wood..; Counteroffer	Counteroffer
offer	counteroffer	WoodnSheep; woo... woo...; Offer	Counteroffer
refusal	offer	Shawnus; :P no thanks; Refusal	[Offer]
refusal	offer	ztime; no ta; Refusal	[Offer]
offer	counteroffer	WoodnSheep; clay for me?; Offer	[Counteroffer]
offer	counteroffer	WoodnSheep; In return for wo*d?; Offer	Counteroffer
refusal	counteroffer	ztime; errr... no sorry; Refusal	Counteroffer
counteroffer	refusal	ztime; anything else?; Counteroffer	[Refusal]
refusal	refusal	WoodnSheep; I have nothing else; Refusal	[Refusal]
offer	offer	WoodnSheep; clay for wheat?; Offer	[Offer]
refusal	offer	ztime; no sorry; Refusal	[Offer]
refusal	refusal	Shawnus; i dont have any; Refusal	[Refusal]
offer	refusal	ztime; ok anyone want a clay now?; Offer	[Refusal]
refusal	counteroffer	WoodnSheep; no thanks; Refusal	Counteroffer
offer	offer	ztime; I'm after sheep; Offer	[Offer]
accept	counteroffer	Shawnus; ok; Accept	Counteroffer
offer	counteroffer	ztime; anyone want ore?; Offer	Counteroffer
offer	counteroffer	ztime; I'm after wood; Offer	Counteroffer
refusal	counteroffer	WoodnSheep; no thanks; Refusal	Counteroffer
refusal	offer	Shawnus; nope; Refusal	[Offer]
offer	offer	WoodnSheep; I'd like some wheat?; Offer	[Offer]
offer	accept	WoodnSheep; I have wood...; Offer	[Accept]
refusal	offer	Shawnus; me too; Refusal	[Offer]
offer	offer	WoodnSheep; clay?; Offer	[Offer]
refusal	offer	ztime; no can do..; Refusal	[Offer]
refusal	offer	Shawnus; got none; Refusal	[Offer]
offer	counteroffer	WoodnSheep; no one has wheat?; Offer	Counteroffer
refusal	counteroffer	ztime; no; Refusal	Counteroffer
refusal	offer	Shawnus; nope; Refusal	[Offer]
offer	other	WoodnSheep; sheep for me?; Offer	[Other]
refusal	offer	ztime; sorry; Refusal	[Offer]
refusal	offer	Shawnus; nope sorry; Refusal	[Offer]
offer	offer	ztime; anyone want wood?; Offer	[Offer]
refusal	offer	Shawnus; nope; Refusal	[Offer]
refusal	offer	WoodnSheep; no thanks; Refusal	[Offer]
offer	other	ztime; anyone want wood?; Offer	[Other]
refusal	offer	WoodnSheep; no thanks; Refusal	[Offer]
offer	offer	ztime; err. anyone want ore?; Offer	[Offer]
offer	offer	ztime; I'm after wheat; Offer	[Offer]
refusal	offer	Shawnus; no thanks; Refusal	[Offer]
counteroffer	offer	WoodnSheep; can you chuck in a peice of wood?; Counteroffer	[Offer]
counteroffer	offer	WoodnSheep; as well that is; Counteroffer	[Offer]
accept	offer	ztime; yer; Accept	[Offer]
counteroffer	offer	ztime; 1 wood and 1 ore.. for a wheat..; Counteroffer	[Offer]
accept	counteroffer	WoodnSheep; cool; Accept	Counteroffer
counteroffer	counteroffer	Shawnus; do you have a sheep to trade?; Counteroffer	Counteroffer
offer	offer	Shawnus; anyone want to trade my lovely wood for some wheat?; Offer	[Offer]
refusal	counteroffer	ztime; sorry; Refusal	Counteroffer
refusal	refusal	WoodnSheep; sorry; Refusal	[Refusal]
offer	offer	WoodnSheep; I'd like some sheep?; Offer	[Offer]
refusal	counteroffer	ztime; srry can't help; Refusal	[Counteroffer]
refusal	refusal	Shawnus; nope sorry; Refusal	[Refusal]
offer	offer	WoodnSheep; I'd like a wheat?; Offer	[Offer]
offer	offer	WoodnSheep; wood?; Offer	[Offer]
offer	counteroffer	WoodnSheep; or maybe sheep?; Offer	[Counteroffer]
counteroffer	counteroffer	ztime; sheep; Counteroffer	Counteroffer
accept	offer	ztime; ok; Accept	[Offer]
offer	offer	Shawnus; anyone got a sheep to trade?; Offer	[Offer]
offer	counteroffer	Shawnus; a wood or a clay?; Offer	Counteroffer
refusal	offer	ztime; no sorry; Refusal	[Offer]
offer	offer	ztime; how would you like to have some of my clay?; Offer	[Offer]
offer	counteroffer	ztime; for ore?; Offer	Counteroffer
offer	offer	ztime; or wheat?; Offer	[Offer]
refusal	offer	Shawnus; i dont have enough sorry; Refusal	[Offer]
offer	offer	catanstrophe; anyone have brick?; Offer	[Offer]
refusal	counteroffer	zorburt; no brick.; Refusal	Counteroffer
refusal	offer	raefbrisbin; nope; Refusal	[Offer]
offer	counteroffer	catanstrophe; anyone have ore?; Offer	Counteroffer
accept	offer	raefbrisbin; yup; Accept	[Offer]
accept	counteroffer	zorburt; i hav an ore; Accept	Counteroffer
accept	offer	raefbrisbin; 4; Accept	[Offer]
offer	counteroffer	catanstrophe; will trade a sheep or wood or wheat; Offer	Counteroffer
counteroffer	counteroffer	raefbrisbin; wood; Counteroffer	Counteroffer
counteroffer	counteroffer	zorburt; i'll take wood or wheat for an ore; Counteroffer	Counteroffer
counteroffer	offer	raefbrisbin; for 2; Counteroffer	[Offer]
counteroffer	counteroffer	catanstrophe; ok will trade wood hold on let me figure this out; Counteroffer	Counteroffer
counteroffer	offer	catanstrophe; can you do 1 for 1?; Counteroffer	[Offer]
accept	counteroffer	zorburt; i can!; Accept	[Counteroffer]
counteroffer	offer	raefbrisbin; i'll give 2 i'll give 2; Counteroffer	[Offer]
counteroffer	counteroffer	raefbrisbin; wood; Counteroffer	[Counteroffer]
accept	counteroffer	catanstrophe; oksounds good; Accept	Counteroffer
offer	refusal	zorburt; trade a sheep or ore for a clay?; Offer	[Refusal]
offer	offer	zorburt; anyone?; Offer	[Offer]
offer	counteroffer	zorburt; sorry not clay. wood.; Offer	Counteroffer
refusal	counteroffer	raefbrisbin; nay; Refusal	Counteroffer
refusal	offer	catanstrophe; no i am looking for clay as well no i am looking for clay as well; Refusal	[Offer]
offer	offer	zorburt; sorry, essentially i need wood. i mistyped.; Offer	[Offer]
counteroffer	offer	catanstrophe; ok i have one to trade for one clay; Counteroffer	[Offer]
refusal	counteroffer	zorburt; bah i need my clay. thanks tho; Refusal	Counteroffer
offer	offer	catanstrophe; i am looking for grain. can trade sheep or wood; Offer	[Offer]
refusal	counteroffer	raefbrisbin; none; Refusal	Counteroffer
refusal	refusal	zorburt; none.; Refusal	[Refusal]
offer	offer	catanstrophe; does anyone have sheep? does anyone have sheep?; Offer	[Offer]
counteroffer	offer	Ghettoette; have sheep for ore or brick; Counteroffer	[Offer]
counteroffer	counteroffer	zorburt; i'll trade a sheep for brick.; Counteroffer	[Counteroffer]
accept	counteroffer	Ghettoette; ok; Accept	Counteroffer
offer	counteroffer	catanstrophe; i can give one wood for one sheep?; Offer	Counteroffer
accept	counteroffer	zorburt; yeah i can do that. sorry i got cofused earlier with ghettoette.; Accept	Counteroffer
counteroffer	offer	zorburt; catanstrophe: i can give you a sheep for your wood.; Counteroffer	[Offer]
accept	counteroffer	catanstrophe; ok zorburt i will gie you one wood for one sheep; Accept	Counteroffer
accept	counteroffer	zorburt; excellent.; Accept	Counteroffer
offer	offer	catanstrophe; anyone have wheat; Offer	[Offer]
refusal	offer	zorburt; no; Refusal	[Offer]
refusal	refusal	Ghettoette; sorry; Refusal	[Refusal]
refusal	offer	raefbrisbin; sorry; Refusal	[Offer]
offer	offer	catanstrophe; brick?; Offer	[Offer]
refusal	counteroffer	raefbrisbin; nope; Refusal	Counteroffer
refusal	offer	Ghettoette; nope; Refusal	[Offer]
refusal	offer	zorburt; no; Refusal	[Offer]
offer	offer	zorburt; anyone have brick now?; Offer	[Offer]
refusal	offer	catanstrophe; no 10s rolled; Refusal	[Offer]
offer	counteroffer	raefbrisbin; looking to trade wheat for ore; Offer	Counteroffer
accept	offer	catanstrophe; here; Accept	[Offer]
accept	offer	catanstrophe; i can do it; Accept	[Offer]
offer	counteroffer	raefbrisbin; need 2 ore?; Offer	Counteroffer
counteroffer	offer	catanstrophe; i can give you ore; Counteroffer	[Offer]
offer	offer	raefbrisbin; want 2 ore; Offer	[Offer]
counteroffer	counteroffer	catanstrophe; i can do 1 for 1; Counteroffer	[Counteroffer]
counteroffer	counteroffer	catanstrophe; i give one ore for one wheat; Counteroffer	Counteroffer
counteroffer	counteroffer	catanstrophe; or i could do for 2-for-2; Counteroffer	Counteroffer
offer	offer	catanstrophe; raef - are you looking to trade some of that wheat?; Offer	[Offer]
refusal	offer	raefbrisbin; I'm ok right now; Refusal	[Offer]
offer	offer	catanstrophe; i can give an ore or a wood; Offer	[Offer]
refusal	counteroffer	raefbrisbin; evryone needs clay evryone needs clay; Refusal	[counteroffer]
offer	counteroffer	Ghettoette; anyone have ore to trade me for wheat or sheep?; Offer	Counteroffer
