true_act	pred_act	true_turn	pred_turn
refusal	offer	ztime; errr... no sorry; Refusal	[Offer]
counteroffer	other	ztime; anything else?; Counteroffer	[Other]
refusal	other	WoodnSheep; I have nothing else; Refusal	[Other]
refusal	accept	ztime; no sorry; Refusal	[Accept]
refusal	other	Shawnus; i dont have any; Refusal	[Other]
refusal	offer	WoodnSheep; no thanks; Refusal	[Offer]
offer	other	ztime; I'm after sheep; Offer	[Other]
accept	offer	Shawnus; ok; Accept	[Offer]
offer	other	ztime; anyone want ore?; Offer	[Other]
offer	accept	ztime; I'm after wood; Offer	[Accept]
refusal	offer	WoodnSheep; no thanks; Refusal	[Offer]
refusal	other	Shawnus; nope; Refusal	[Other]
offer	other	WoodnSheep; I have wood...; Offer	[Other]
refusal	offer	Shawnus; me too; Refusal	[Offer]
offer	other	WoodnSheep; clay?; Offer	[Other]
refusal	offer	ztime; no can do..; Refusal	[Offer]
refusal	other	Shawnus; got none; Refusal	[Other]
offer	offer	WoodnSheep; no one has wheat?; Offer	[Offer]
refusal	other	ztime; no; Refusal	[Other]
refusal	other	Shawnus; nope; Refusal	[Other]
refusal	offer	ztime; sorry; Refusal	[Offer]
refusal	other	Shawnus; nope sorry; Refusal	[Other]
refusal	offer	Shawnus; nope; Refusal	[Offer]
refusal	other	WoodnSheep; no thanks; Refusal	[Other]
offer	other	ztime; anyone want wood?; Offer	[Other]
refusal	offer	WoodnSheep; no thanks; Refusal	[Offer]
offer	other	ztime; err. anyone want ore?; Offer	[Other]
offer	offer	ztime; I'm after wheat; Offer	[Offer]
refusal	offer	Shawnus; no thanks; Refusal	[Offer]
counteroffer	other	WoodnSheep; can you chuck in a peice of wood?; Counteroffer	[Other] 
counteroffer	other	WoodnSheep; as well that is; Counteroffer	[Other] 
accept	other	ztime; yer; Accept	[Other]
counteroffer	other	ztime; 1 wood and 1 ore.. for a wheat..; Counteroffer	[Other]
accept	accept	WoodnSheep; cool; Accept	[Accept]
counteroffer	other	Shawnus; do you have a sheep to trade?; Counteroffer	[Other]
refusal	counteroffer	ztime; sorry; Refusal	[Counteroffer]
refusal	other	WoodnSheep; sorry; Refusal	[Other]
refusal	offer	ztime; srry can't help; Refusal	[Offer]
refusal	other	Shawnus; nope sorry; Refusal	[Other]
offer	offer	WoodnSheep; wood?; Offer	[Offer]
offer	offer	WoodnSheep; or maybe sheep?; Offer	[Offer]
counteroffer	other	ztime; sheep; Counteroffer	[Other]
accept	other	ztime; ok; Accept	[Other]
offer	other	Shawnus; a wood or a clay?; Offer	[Other]
refusal	offer	ztime; no sorry; Refusal	[Offer]
offer	accept	ztime; for ore?; Offer	[Accept]
offer	other	ztime; or wheat?; Offer	[Other]
refusal	other	Shawnus; i dont have enough sorry; Refusal	[Other]
offer	offer	catanstrophe; anyone have brick?; Offer	[Offer]
refusal	other	zorburt; no brick.; Refusal	[Other]
refusal	other	raefbrisbin; nope; Refusal	[Other]
accept	offer	raefbrisbin; yup; Accept	[Offer]
accept	other	zorburt; i hav an ore; Accept	[Other]
accept	offer	raefbrisbin; 4; Accept	[Offer]
offer	other	catanstrophe; will trade a sheep or wood or wheat; Offer	[Other]
counteroffer	offer	raefbrisbin; wood; Counteroffer	[Offer]
counteroffer	other	zorburt; i'll take wood or wheat for an ore; Counteroffer	[Other]
counteroffer	offer	raefbrisbin; for 2; Counteroffer	[Offer]
counteroffer	refusal	catanstrophe; ok will trade wood hold on let me figure this out; Counteroffer	[Refusal]
counteroffer	other	catanstrophe; can you do 1 for 1?; Counteroffer	[Other]
accept	refusal	zorburt; i can!; Accept	[Refusal]
counteroffer	offer	raefbrisbin; i'll give 2 i'll give 2; Counteroffer	[Offer]
counteroffer	refusal	raefbrisbin; wood; Counteroffer	[Refusal]
accept	other	catanstrophe; oksounds good; Accept	[Other]
offer	refusal	zorburt; anyone?; Offer	[Refusal]
offer	offer	zorburt; sorry not clay. wood.; Offer	[Offer]
refusal	offer	raefbrisbin; nay; Refusal	[Offer]
refusal	other	catanstrophe; no i am looking for clay as well no i am looking for clay as well; Refusal	[Other]
offer	other	zorburt; sorry, essentially i need wood. i mistyped.; Offer	[Other]
counteroffer	other	catanstrophe; ok i have one to trade for one clay; Counteroffer	[Other]
refusal	counteroffer	zorburt; bah i need my clay. thanks tho; Refusal	[Counteroffer]
refusal	offer	raefbrisbin; none; Refusal	[Offer]
refusal	offer	zorburt; none.; Refusal	[Offer]
offer	other	catanstrophe; does anyone have sheep? does anyone have sheep?; Offer	[Other]
counteroffer	offer	Ghettoette; have sheep for ore or brick; Counteroffer	[Offer]
counteroffer	offer	zorburt; i'll trade a sheep for brick.; Counteroffer	[Offer]
accept	accept	Ghettoette; ok; Accept	[Accept]
offer	other	catanstrophe; i can give one wood for one sheep?; Offer	[Other]
accept	other	zorburt; yeah i can do that. sorry i got cofused earlier with ghettoette.; Accept	[Other]
counteroffer	other	zorburt; catanstrophe: i can give you a sheep for your wood.; Counteroffer	[Other]
accept	other	catanstrophe; ok zorburt i will gie you one wood for one sheep; Accept	[Other]
accept	counteroffer	zorburt; excellent.; Accept	Counteroffer
offer	offer	catanstrophe; anyone have wheat; Offer	[Offer]
refusal	offer	zorburt; no; Refusal	[Offer]
refusal	other	Ghettoette; sorry; Refusal	[Other]
refusal	other	raefbrisbin; sorry; Refusal	[Other]
offer	other	catanstrophe; brick?; Offer	[Other]
refusal	offer	raefbrisbin; nope; Refusal	[Offer]
refusal	offer	Ghettoette; nope; Refusal	[Offer]
refusal	other	zorburt; no; Refusal	[Other]
refusal	other	catanstrophe; no 10s rolled; Refusal	[Other]
accept	offer	catanstrophe; here; Accept	[Offer]
accept	offer	catanstrophe; i can do it; Accept	[Offer]
offer	offer	raefbrisbin; need 2 ore?; Offer	[Offer]
counteroffer	other	catanstrophe; i can give you ore; Counteroffer	[Accept] 
offer	offer	raefbrisbin; want 2 ore; Offer	[Offer]
counteroffer	offer	catanstrophe; i can do 1 for 1; Counteroffer	[Offer]
counteroffer	offer	catanstrophe; i give one ore for one wheat; Counteroffer	[Offer]
counteroffer	accept	catanstrophe; or i could do for 2-for-2; Counteroffer	[Accept]
offer	other	catanstrophe; raef - are you looking to trade some of that wheat?; Offer	[Other]
refusal	other	raefbrisbin; I'm ok right now; Refusal	[Other]
offer	other	catanstrophe; i can give an ore or a wood; Offer	[Other]
refusal	offer	raefbrisbin; evryone needs clay evryone needs clay; Refusal	[Offer]
offer	other	Ghettoette; anyone have ore to trade me for wheat or sheep?; Offer	[Other]
refusal	other	zorburt; no; Refusal	[Other]
counteroffer	other	catanstrophe; i'll give one ore for 2 wheat; Counteroffer	[Other]
accept	other	Ghettoette; ok; Accept	[Other]
accept	other	catanstrophe; ok sounds good; Accept	[Other]
counteroffer	offer	zorburt; i can give you a wood.; Counteroffer	[Offer]
counteroffer	other	zorburt; for a wheat?; Counteroffer	[Other]
accept	accept	Ghettoette; ok; Accept	[Accept]
counteroffer	other	zorburt; 2 wheats? 2 wheats?; Counteroffer	[Other]
refusal	counteroffer	Ghettoette; can't do; Refusal	[Counteroffer]
refusal	offer	Ghettoette; nope; Refusal	[Offer]
refusal	other	zorburt; no; Refusal	[Other]
offer	other	zorburt; does anyone want to give me a wood?; Offer	[Other]
accept	offer	raefbrisbin; sure; Accept	[Offer]
counteroffer	other	catanstrophe; for brick?; Counteroffer	[Other]
refusal	accept	zorburt; i don't have any brick.; Refusal	[Accept]
offer	offer	zorburt; ok raef. i can give you an ore or a sheep. i can give you an ore or a sheep.; Offer	[Offer]
refusal	counteroffer	catanstrophe; ok i can't trade this time around then; Refusal	[Counteroffer]
counteroffer	other	raefbrisbin; ore; Counteroffer	[Other]
accept	other	zorburt; OK; Accept	[Other]
accept	accept	Ghettoette; sure; Accept	[Accept]
offer	offer	raefbrisbin; want 1-2 sheep; Offer	[Offer]
counteroffer	offer	Ghettoette; will do 1 sheep for 1 wood; Counteroffer	[Offer]
offer	offer	zorburt; i can trade sheep or wood?; Offer	[Offer]
refusal	offer	raefbrisbin; none; Refusal	[Offer]
refusal	other	catanstrophe; cant' do; Refusal	[Other]
refusal	other	Ghettoette; nope; Refusal	[Other]
offer	other	Ghettoette; anyone want to give me a wood for a wheat?; Offer	[Other]
accept	other	zorburt; ok; Accept	[Other]
accept	other	zorburt; i will; Accept	[Other]
accept	offer	Ghettoette; ok; Accept	[Offer]
offer	other	catanstrophe; anyone have  sheep? i can give wheat; Offer	[Other]
offer	offer	catanstrophe; or clay; Offer	[Offer]
offer	offer	catanstrophe; i am looking for sheep or clay i am looking for sheep or clay; Offer	[Offer]
refusal	offer	zorburt; no; Refusal	[Offer]
refusal	other	Ghettoette; nope; Refusal	[Other]
offer	other	raefbrisbin; anyone have an ore?; Offer	[Other]
refusal	other	gramos; no not yet; Refusal	[Other]
refusal	other	zorburt; not for trading sorry; Refusal	[Other]
refusal	offer	raefbrisbin; nope; Refusal	[Offer]
accept	other	zorburt; yeah; Accept	[Other]
offer	other	catanstrophe; i'll give a wheat; Offer	[Other]
counteroffer	offer	zorburt; i need brick though.; Counteroffer	[Offer]
offer	other	catanstrophe; could you throw in a sheep with the wood?; Offer	[Other]
offer	counteroffer	catanstrophe; i'll give you the brick; Offer	[Counteroffer]
accept	offer	zorburt; yeah ok.; Accept	[Offer]
offer	refusal	raefbrisbin; anyone to trade an ore, got everything; Offer	[Refusal]
counteroffer	other	gramos; I'll trade ore for wheat; Counteroffer	[Other]
counteroffer	other	raefbrisbin; brick?; Counteroffer	[Other]
accept	offer	zorburt; i'll trade for brick i'll trade for brick; Accept	[Offer]
counteroffer	offer	catanstrophe; i have an ore, want brick; Counteroffer	[Offer]
counteroffer	offer	zorburt; i don't have anything else to offer but an ore; Counteroffer	[Offer]
refusal	other	raefbrisbin; can't sorry; Refusal	[Other]
refusal	other	zorburt; no; Refusal	[Other]
refusal	other	catanstrophe; no; Refusal	[Other]
accept	refusal	catanstrophe; ok i'll do it; Accept	[Refusal]
counteroffer	other	catanstrophe; i;ll take 2 ore, and give one wood; Counteroffer	[Other]
accept	other	raefbrisbin; going... anyone else anyone else; Accept	[Other]
refusal	other	gramos; no, I"ll pass. tempting, though.; Refusal	[Other]
accept	other	raefbrisbin; ? sold; Accept	[Other]
offer	other	zorburt; does anyone want to give me a wheat and i give them an ore?; Offer	[Other]
refusal	refusal	raefbrisbin; 0 resources; Refusal	[Refusal]
refusal	offer	gramos; Not I.; Refusal	[Offer]
refusal	other	catanstrophe; cant; Refusal	[Other]
refusal	offer	raefbrisbin; none; Refusal	[Offer]
refusal	offer	gramos; I am starving for wheat here myself.; Refusal	[Offer]
offer	offer	catanstrophe; or brick?; Offer	[Offer]
refusal	offer	raefbrisbin; gotta hold off, you're kinda set up; Refusal	[Offer]
refusal	other	gramos; no, I have only 1 of 1; Refusal	[Other]
counteroffer	other	catanstrophe; yeah ia m looking for either; Counteroffer	[Other]
counteroffer	offer	gramos; I guess I might trade for sheep; Counteroffer	[Offer]
accept	offer	catanstrophe; ok i will give a sheep for an ore? i will give a sheep for an ore?; Accept	[Offer]
counteroffer	refusal	gramos; I'll give you 1 ore for a sheep; Counteroffer	[Refusal]
accept	refusal	catanstrophe; sounds good; Accept	[Refusal]
accept	other	gramos; ok; Accept	[Other]
offer	offer	raefbrisbin; 2 sheep?; Offer	[Offer]
refusal	offer	zorburt; no; Refusal	[Offer]
refusal	other	gramos; not me; Refusal	[Other]
refusal	other	catanstrophe; dont have any; Refusal	[Other] 
refusal	offer	gramos; no, it's all in the ground lining my road; Refusal	[Offer]
counteroffer	other	raefbrisbin; only for ore; Counteroffer	[Other]
counteroffer	offer	zorburt; as in i give you an ore?; Counteroffer	[Offer]
counteroffer	accept	raefbrisbin; needed 2; Counteroffer	[Accept]
counteroffer	offer	zorburt; i don't have 2 ores to give you. i can give you an ore and a sheep.; Counteroffer	[Offer]
accept	counteroffer	raefbrisbin; ok; Accept	[Counteroffer]
refusal	other	raefbrisbin; nope; Refusal	[Other]
refusal	other	gramos; no clay for you, sorry.; Refusal	[Other]
offer	other	catanstrophe; or ore?; Offer	[Other]
offer	offer	gramos; 1 wood, that is; Offer	[Offer]
accept	offer	zorburt; i'll do that.; Accept	[Offer]
counteroffer	other	catanstrophe; i can give a wheat; Counteroffer	[Other]
counteroffer	offer	zorburt; i'll give you a sheep; Counteroffer	[Offer]
counteroffer	offer	raefbrisbin; wheat; Counteroffer	[Offer]
offer	other	catanstrophe; gramos - are you willing to trade out that brick?; Offer	[Other]
accept	other	gramos; yeah, sure. I have lotso brick; Accept	[Other]
offer	other	catanstrophe; i can give a wheat i can give a wheat; Offer	[Other]
accept	offer	gramos; ok, brick for wheat. Deal.; Accept	[Offer]
accept	other	catanstrophe; ok; Accept	[Other]
offer	other	gramos; I can give brick to someone who will part with wood...; Offer	[Other]
offer	offer	zorburt; i have sheep and wheat to trade for brick or wood. any takers?; Offer	[Offer]
refusal	other	catanstrophe; all i have is sheep; Refusal	[Other]
refusal	other	raefbrisbin; same same; Refusal	[Other]
counteroffer	other	gramos; I'll take a sheep, I can give brick; Counteroffer	[Other]
counteroffer	offer	raefbrisbin; i can give 1-4; Counteroffer	[Offer]
counteroffer	accept	gramos; have you any wood as well? have you any wood as well?; Counteroffer	[Accept]
refusal	offer	zorburt; i have NO wood.; Refusal	[Offer]
offer	offer	zorburt; i'd like wood.; Offer	[Offer]
accept	offer	gramos; Ok, 1 brick for 1 sheep; Accept	[Offer]
offer	refusal	zorburt; i'll give you a sheep for a brick.; Offer	[Refusal]
accept	accept	zorburt; cool thanks.; Accept	[Accept]
refusal	offer	gramos; alas, no; Refusal	[Offer]
refusal	other	raefbrisbin; sorry, you're basically at 7 points; Refusal	[Other]
refusal	other	zorburt; no sorry.; Refusal	[Other]
offer	other	catanstrophe; anyne have wheat? i will give a wood; Offer	[Other]
refusal	offer	gramos; I need the 1 I have; Refusal	[Offer]
refusal	other	zorburt; no sorry; Refusal	[Other]
offer	other	gramos; does anyone need an ore? I could wood or *ahem* sheep; Offer	[Other]
counteroffer	offer	catanstrophe; i'll trade a sheep for an ore; Counteroffer	[Offer]
counteroffer	other	raefbrisbin; I'll give 2; Counteroffer	[Other]
counteroffer	other	catanstrophe; two ore for one sheep?; Counteroffer	[Other]
refusal	counteroffer	gramos; I have only 1 ore; Refusal	Counteroffer
accept	other	catanstrophe; oh one for one is fine; Accept	[Other]
counteroffer	other	raefbrisbin; 2 sheep for an ore 2 sheep for an ore; Counteroffer	[Other]
counteroffer	counteroffer	catanstrophe; or i can go 2 as well or i can go 2 as well; Counteroffer	[Counteroffer]
offer	other	zorburt; does anyone have brick or wood to trade with me?; Offer	[Other]
offer	offer	zorburt; i have wheat and ... sheep.; Offer	[Offer]
refusal	counteroffer	gramos; no; Refusal	Counteroffer
offer	other	raefbrisbin; anyone want brick?; Offer	[Other]
accept	offer	zorburt; yes.; Accept	[Offer]
offer	other	raefbrisbin; a wood? a wood?; Offer	[Other]
counteroffer	offer	zorburt; i have wheat to give tho.; Counteroffer	[Offer]
refusal	offer	zorburt; no sorry.; Refusal	[Offer]
accept	other	raefbrisbin; ok, 1:1 ?; Accept	[Other]
accept	accept	zorburt; ok.; Accept	[Accept]
refusal	other	zorburt; no sorry one.; Refusal	[Offer] 
refusal	other	gramos; nope.; Refusal	[Other]
refusal	other	raefbrisbin; probably shouldn't as I have 8; Refusal	[Other]
offer	other	gramos; hey, anyone need sheep?; Offer	[Other]
offer	offer	gramos; I could use some wood; Offer	[Offer]
refusal	offer	zorburt; no; Refusal	[Offer]
offer	offer	catanstrophe; will give brick; Offer	[Offer]
refusal	offer	gramos; sorry no; Refusal	[Offer]
refusal	refusal	zorburt; no; Refusal	[Refusal]
refusal	other	Ghettoette; nope; Refusal	[Other]
refusal	offer	zorburt; no; Refusal	[Offer]
refusal	other	Ghettoette; nope; Refusal	[Other]
accept	other	catanstrophe; i can; Accept	[Other]
counteroffer	offer	catanstrophe; i want wood though; Counteroffer	[Offer]
refusal	refusal	gramos; none in stock; Refusal	[Refusal]
offer	other	zorburt; LOL i was going to say, i'll give someone a wood for a brick.; Offer	[Other]
accept	offer	Ghettoette; i'll do that; Accept	[Offer]
accept	other	catanstrophe; i can do it too i can do it too; Accept	[Other]
offer	other	catanstrophe; well if you wanted to do the trade again..; Offer	[Other]
offer	other	catanstrophe; i'll trade you a brick for a wood gramos; Offer	[Other]
accept	refusal	gramos; deal; Accept	[Refusal]
offer	other	catanstrophe; does anyone have sheep?; Offer	[Other]
accept	offer	zorburt; what do you have to trade?; Accept	[Offer]
refusal	offer	gramos; not to spare; Refusal	[Offer]
accept	other	zorburt; yeah ok.; Accept	[Other]
accept	offer	Ghettoette; for a sheep; Accept	[Offer]
refusal	accept	gramos; none, sorry; Refusal	[Accept]
counteroffer	other	zorburt; i don't have sheep... what about a wood or a brick?; Counteroffer	[Other]
refusal	offer	Ghettoette; nah, sorry; Refusal	[Offer]
accept	offer	catanstrophe; i will trade; Accept	[Offer]
counteroffer	other	catanstrophe; i want grain; Counteroffer	[Other]
accept	offer	gramos; ok; Accept	[Offer]
counteroffer	other	zorburt; does anyone want to give me a wheat and i give a wood?; Counteroffer	[Other]
accept	accept	Ghettoette; yes; Accept	[Accept]
accept	other	gramos; yep, I put him there. Didn't think he'd stay THAT long.; Accept	[Other]
offer	other	gramos; anyone need ore?; Offer	[Other]
refusal	other	gramos; No, sorry.; Refusal	[Other]
refusal	other	zorburt; no; Refusal	[Other]
refusal	other	catanstrophe; no; Refusal	[Other]
offer	other	gramos; I have an ore; Offer	[Other]
offer	offer	catanstrophe; wait i give an ore; Offer	[Offer]
offer	other	catanstrophe; you give me a wheat; Offer	[Other]
offer	other	gramos; I have ore not wheat; Offer	[Other]
counteroffer	other	catanstrophe; anyone else?; Counteroffer	[Other]
refusal	other	zorburt; no; Refusal	[Other]
refusal	other	Ghettoette; nope; Refusal	[Other]
refusal	offer	gramos; only one that I need; Refusal	[Offer]
refusal	offer	Ghettoette; no; Refusal	[Offer]
offer	offer	catanstrophe; how about brick?; Offer	[Offer]
offer	offer	Ghettoette; for a sheep; Offer	[Offer]
counteroffer	offer	catanstrophe; for an ore?; Counteroffer	[Offer]
offer	refusal	gramos; I can spare a brick; Offer	[Refusal]
counteroffer	offer	gramos; for sheep; Counteroffer	[Offer]
refusal	offer	catanstrophe; i dont have any sheep; Refusal	[Offer]
offer	offer	catanstrophe; i could do an ore or a wood; Offer	[Offer]
counteroffer	offer	catanstrophe; for a brick; Counteroffer	[Offer]
accept	other	gramos; ok, I"ll take wood in exchange for your brick; Accept	[Other]
accept	offer	Ghettoette; yes, brick; Accept	[Offer]
accept	offer	Ghettoette; yes, for ore; Accept	[Offer]
accept	offer	catanstrophe; ok deal; Accept	[Offer]
offer	offer	Ghettoette; brick or wheat; Offer	[Offer]
accept	offer	zorburt; i'm ok.; Accept	[Offer]
accept	other	Ghettoette; ok; Accept	[Other]
refusal	other	Ghettoette; sorry; Refusal	[Other]
offer	other	Ghettoette; now that a 9 is finally rolled, anyone want to trade a sheep?; Offer	[Other]
accept	offer	catanstrophe; yes; Accept	[Offer]
accept	other	zorburt; yes.; Accept	[Other]
offer	other	catanstrophe; i want graom; Offer	[Other]
accept	other	Ghettoette; ok; Accept	[Other]
offer	other	gramos; I can trade clay and wood; Offer	[Other]
refusal	offer	zorburt; lol no; Refusal	[Offer]
refusal	other	Ghettoette; nope; Refusal	[Other]
offer	other	zorburt; ghettoette, do you have any wheat you want to pass along my way?; Offer	[Other]
offer	offer	Ghettoette; for a sheep?; Offer	[Offer]
counteroffer	other	zorburt; for a brick and a wood?; Counteroffer	[Other]
offer	offer	zorburt; no as in i give you a brick and a wood.; Offer	[Offer]
offer	counteroffer	zorburt; you give me a wheat.; Offer	[Counteroffer]
accept	accept	Ghettoette; oh yeah ... yes, that works; Accept	[Accept]
offer	other	gramos; I"ve got wood I'll trade to you; Offer	[Other]
refusal	offer	gramos; no; Refusal	[Offer]
refusal	other	gramos; none none; Refusal	[Other]
refusal	offer	Ghettoette; nope; Refusal	[Offer]
offer	other	gramos; I would like some ore. I would like some ore. I can offer wheat...; Offer	[Other]
offer	other	Ghettoette; anyone want to give me wood for brick or wheat?; Offer	[Other]
refusal	refusal	raefbrisbin; lol; Refusal	[Refusal]
refusal	other	gramos; none to give, alas; Refusal	[Other]
offer	refusal	catanstrophe; i will give 1 sheep...; Offer	[Refusal]
accept	offer	gramos; ok, I'll take that; Accept	[Offer]
offer	offer	gramos; anyone have ore?; Offer	[Offer]
accept	offer	raefbrisbin; ya; Accept	[Offer]
offer	other	catanstrophe; i can give you a sheep; Offer	[Other]
accept	offer	gramos; i have lots; Accept	[Offer]
counteroffer	other	catanstrophe; wood?; Counteroffer	[Other]
accept	offer	gramos; yes, give me wood and I'll give you wheat; Accept	[Offer]
offer	offer	raefbrisbin; anyone have a wheat or ore?; Offer	[Offer]
accept	offer	gramos; I have wheat engouh for all of you; Accept	[Offer]
counteroffer	offer	raefbrisbin; wood for ore?; Counteroffer	[Offer]
counteroffer	counteroffer	raefbrisbin; for wheat; Counteroffer	[Counteroffer]
accept	other	gramos; I can give you wheat if you giv eme wood, yes; Accept	[Other]
counteroffer	other	raefbrisbin; 1:1?; Counteroffer	[Other]
accept	other	gramos; you can give me 2 wood if you'd like. otherwise 1-1; Accept	[Other]
accept	refusal	gramos; yes, I can give 1-1 a sheep for your brick I can give 1-1 a sheep for your brick; Accept	[Refusal]
accept	counteroffer	Ghettoette; ok; Accept	[Counteroffer]
accept	offer	gramos; yess; Accept	[Offer]
counteroffer	other	gramos; can offer clay or sheep; Counteroffer	[Other]
accept	offer	raefbrisbin; clay please; Accept	[Offer]
accept	offer	gramos; go for it.; Accept	[Offer]
offer	other	raefbrisbin; anyone more?; Offer	[Other]
offer	other	raefbrisbin; any more?; Offer	[Other]
offer	other	gramos; we can do the same again; Offer	[Other]
counteroffer	offer	raefbrisbin; looking for a sheep?; Counteroffer	[Offer]
counteroffer	offer	gramos; ore for brick/clay; Counteroffer	[Offer]
refusal	offer	raefbrisbin; sorry that;s for sheep that;s for sheep; Refusal	[Offer]
accept	other	gramos; t's good; Accept	[Other]
accept	other	raefbrisbin; k; Accept	[Other]
accept	offer	raefbrisbin; ya; Accept	[Offer]
offer	other	catanstrophe; i'll give youa sheep; Offer	[Other]
counteroffer	offer	raefbrisbin; need only wood/clay; Counteroffer	[Offer]
refusal	offer	catanstrophe; darn; Refusal	[Offer]
counteroffer	other	catanstrophe; two sheep?; Counteroffer	[Other]
refusal	other	raefbrisbin; no help sorry; Refusal	[Other]
offer	other	catanstrophe; does anyne have clay?; Offer	[Other]
accept	offer	gramos; I have one I can trade; Accept	[Offer]
counteroffer	other	catanstrophe; what do ypu want?; Counteroffer	[Other]
counteroffer	other	gramos; wood would be great, else ore; Counteroffer	[Other]
refusal	offer	catanstrophe; ugh dont have it; Refusal	[Offer]
counteroffer	other	catanstrophe; anything else? anything else?; Counteroffer	[Other]
refusal	other	gramos; no sorry; Refusal	[Other]
accept	counteroffer	gramos; I have a clay for you raef; Accept	[Counteroffer]
accept	accept	raefbrisbin; k; Accept	[Accept]
offer	offer	catanstrophe; anyone have ore?; Offer	[Offer]
accept	offer	raefbrisbin; yup; Accept	[Offer]
counteroffer	other	raefbrisbin; just 1; Counteroffer	[Other]
counteroffer	other	catanstrophe; i'll give you a sheep or wheat?; Counteroffer	[Other]
accept	offer	raefbrisbin; sheep; Accept	[Offer]
accept	other	Ghettoette; yes; Accept	[Other]
accept	offer	Ghettoette; for a sheep or brick; Accept	[Offer]
counteroffer	other	gramos; I can offer brick....; Counteroffer	[Offer] 
accept	counteroffer	Ghettoette; ok; Accept	[Counteroffer]
accept	other	gramos; take your pick, sheep or brick; Accept	[Other]
accept	offer	raefbrisbin; i have a wood; Accept	[Offer]
accept	offer	raefbrisbin; brick if in it; Accept	[Offer]
accept	other	gramos; I will trade with both! sheep for ghettoette, brick for raef sheep for ghettoette, brick for raef sheep for ghettoette, brick for raef; Accept	[Other]
accept	offer	Ghettoette; ok; Accept	[Offer]
accept	other	raefbrisbin; k; Accept	[Other]
offer	other	Ghettoette; anyone want to give a brick for wheat?; Offer	[Other]
refusal	refusal	raefbrisbin; o brickn; Refusal	[Refusal]
refusal	offer	raefbrisbin; no; Refusal	[Offer]
refusal	offer	gramos; none left; Refusal	[Offer]
counteroffer	other	Ghettoette; for?; Counteroffer	[Other]
counteroffer	other	catanstrophe; ore; Counteroffer	[Other]
counteroffer	other	Ghettoette; 2?; Counteroffer	[Other]
counteroffer	accept	catanstrophe; 01:01; Counteroffer	[Accept]
counteroffer	offer	raefbrisbin; dev cards; Counteroffer	[Offer]
refusal	other	Ghettoette; no thanks; Refusal	[Other]
offer	other	catanstrophe; anyone have sheep; Offer	[Other]
refusal	other	gramos; I'm cleaned out; Refusal	[Offer] 
offer	other	Ghettoette; anyone want a wood or brick for a wheat?; Offer	[Other]
accept	refusal	catanstrophe; yes; Accept	[Refusal]
accept	other	Ghettoette; ok; Accept	[Other]
counteroffer	other	Ghettoette; which?; Counteroffer	[Other]
counteroffer	other	catanstrophe; i'll give a wheat for a brick; Counteroffer	[Other]
accept	refusal	Ghettoette; ok; Accept	[Refusal]
offer	other	catanstrophe; does anone have clay or wheat?; Offer	[Other]
counteroffer	other	gramos; I can give a wheat for ore or umm, clay; Counteroffer	[Other]
counteroffer	offer	catanstrophe; i can give a wood for the wheat; Counteroffer	[Offer]
accept	accept	gramos; ok I'll tak eit; Accept	[Accept]
counteroffer	offer	Ghettoette; for ore?; Counteroffer	[Offer]
refusal	counteroffer	raefbrisbin; sorry; Refusal	[Counteroffer]
counteroffer	other	gramos; I have none. I can offer sheep or wood; Counteroffer	[Other]
refusal	offer	Ghettoette; sorry; Refusal	[Offer]
