true_act	pred_act	true_turn	pred_turn
counteroffer	other	skinnylinny; sabercat: What would you offer?; Counteroffer	[Other]
offer	offer	sabercat; 2x ore; Offer	[Offer]
accept	offer	skinnylinny; Done; Accept	[Offer]
refusal	offer	sabercat; no wheat...; Refusal	[Offer]
refusal	offer	IG; same same; Refusal	[Offer]
counteroffer	offer	skinnylinny; Heh, need an ore; Counteroffer	[Offer]
accept	offer	IG; done; Accept	[Offer]
refusal	other	skinnylinny; I don't have wood; Refusal	[Other]
offer	other	sabercat; have ore...; Offer	[Other]
offer	offer	sabercat; give me the wood and I will give you ore... and if you give me wood and clay you get two ores; Offer	[Offer]
accept	other	skinnylinny; OK; Accept	[Other]
counteroffer	other	IG; two ores for a wood from my end...; Counteroffer	[Other]
counteroffer	refusal	skinnylinny; How about an ore and a sheep for a wood? How about an ore and a sheep for a wood?; Counteroffer	[Refusal]
refusal	refusal	sabercat; no sheep; Refusal	[Refusal]
counteroffer	offer	skinnylinny; IG?; Counteroffer	[Offer]
accept	other	IG; sure sure; Accept	[Other]
refusal	accept	sabercat; no sheep; Refusal	[Accept]
refusal	offer	skinnylinny; Not got any, sorry; Refusal	[Offer]
counteroffer	other	IG; clay/ore for wood?; Counteroffer	[Other]
accept	counteroffer	sabercat; yeah..; Accept	[Counteroffer]
offer	other	sabercat; ore?; Offer	[Other]
refusal	other	sabercat; I dont have wood...; Refusal	[Other]
refusal	offer	skinnylinny; I have no wood, sorry; Refusal	[Offer]
offer	other	skinnylinny; Who wanted wood?; Offer	[Other]
accept	other	IG; me; Accept	[Other]
accept	offer	sabercat; I did; Accept	[Offer]
offer	other	IG; What do you want for it; Offer	[Other]
offer	offer	skinnylinny; Either of you have sheep?; Offer	[Offer]
refusal	offer	IG; Sorry; Refusal	[Offer]
offer	other	skinnylinny; Sorry, meant ore; Offer	[Other]
offer	other	sabercat; two wood for sheep?; Offer	[Other]
accept	counteroffer	IG; i got that]; Accept	[Counteroffer]
offer	other	IG; ore for wood; Offer	[Other]
offer	accept	IG; ?; Offer	[Accept]
offer	other	skinnylinny; Ore for wood... Ore for wood... One each? One each? One each?; Offer	[Other]
accept	accept	IG; sure; Accept	[Accept]
accept	other	sabercat; okay okay; Accept	[Other]
offer	other	skinnylinny; As in, one ore per wood, one wood per person?; Offer	[Other]
accept	other	sabercat; yes; Accept	[Other]
accept	offer	IG; yea, you got sheep? you got sheep?; Accept	[Offer]
counteroffer	offer	sabercat; nope... wood?; Counteroffer	[Offer]
accept	offer	IG; go on then; Accept	[Offer]
offer	other	skinnylinny; I have ore, would trade for wood; Offer	[Other]
refusal	offer	sabercat; have none; Refusal	[Offer]
refusal	offer	skinnylinny; Sorry; Refusal	[Offer]
accept	offer	IG; yea; Accept	[Offer]
offer	other	sabercat; what do you need?; Offer	[Other]
offer	other	IG; need sheep...; Offer	[Other]
refusal	offer	sabercat; have none; Refusal	[Offer]
refusal	offer	sabercat; sorry; Refusal	[Offer]
offer	other	skinnylinny; Does anyone have any wood?; Offer	[Other]
refusal	offer	sabercat; nope; Refusal	[Offer]
refusal	other	IG; sorry; Refusal	[Other]
counteroffer	other	skinnylinny; Or does anyone have any ore they'd give me for a clay or a sheep?; Counteroffer	[Other]
refusal	other	sabercat; nope; Refusal	[Other]
refusal	other	IG; nah; Refusal	[Other]
offer	other	sabercat; anyone has ore? for sheep? or clay?; Offer	[Other]
counteroffer	offer	IG; only for wood; Counteroffer	[Offer]
counteroffer	other	sabercat; how about clay for sheep:; Counteroffer	[Other]
refusal	other	IG; and sorry, no clay for sheep; Refusal	[Other]
offer	offer	sabercat; skinnylinny?; Offer	[Offer]
refusal	offer	skinnylinny; No thanks No thanks; Refusal	[Offer]
offer	other	IG; so I need wood...; Offer	[Other]
refusal	offer	skinnylinny; Sorry, not got any; Refusal	[Offer]
refusal	offer	sabercat; nope... none here :( nope... none here :(; Refusal	[Offer]
offer	other	sabercat; som wood please?; Offer	[Other]
offer	offer	skinnylinny; sabercat: What are you offering?; Offer	[Offer]
offer	offer	IG; hey, I want wood as well; Offer	[Offer]
offer	offer	sabercat; ore and clay; Offer	[Offer]
offer	offer	IG; offering 2 ore for one wood; Offer	[Offer]
offer	refusal	skinnylinny; If anyone offers me one ore and one wheat they can have a wood If anyone offers me one ore and one wheat they can have a wood; Offer	[Refusal]
accept	offer	IG; go on then; Accept	[Offer]
offer	other	sabercat; okay, can anyone give me clay?; Offer	[Other]
offer	offer	sabercat; for ore?; Offer	[Offer]
accept	offer	skinnylinny; IG, on your turn; Accept	[Offer]
offer	other	sabercat; which one?; Offer	[Other]
offer	other	sabercat; skinny, give me clay for ore?; Offer	[Other]
refusal	other	skinnylinny; I have no clay; Refusal	[Other]
offer	other	skinnylinny; Does that mean you won't trade with me, IG?; Offer	[Other]
refusal	other	IG; looks like it; Refusal	[Other]
offer	other	skinnylinny; I need an ore...; Offer	[Other]
offer	offer	skinnylinny; Anyone got one for a sheep?; Offer	[Offer]
offer	offer	IG; what are you offfering?; Offer	[Offer]
refusal	offer	IG; na na; Refusal	[Offer]
offer	offer	skinnylinny; Or another wood...; Offer	[Offer]
accept	offer	IG; haha deal; Accept	[Offer]
offer	other	sabercat; I need 2 sheep...; Offer	[Other]
offer	offer	skinnylinny; What do you want for them? What do you want for them?; Offer	[Offer]
offer	other	sabercat; can you trade for 3 clays; Offer	[Other]
counteroffer	offer	skinnylinny; I'll give you two sheep for 2 clay or for a clay and a wheat or a clay and a wood; Counteroffer	[Offer]
refusal	counteroffer	sabercat; dont have the other...; Refusal	[Counteroffer]
counteroffer	other	skinnylinny; 2 sheep for 2 clay?; Counteroffer	[Other]
accept	refusal	sabercat; okay :D; Accept	[Refusal]
refusal	other	skinnylinny; I didn't want three clay I didn't want three clay; Refusal	[Other]
refusal	accept	amycharl; nope; Refusal	[Accept]
refusal	other	sabercat; nope; Refusal	[Other]
refusal	other	IG; sorry; Refusal	[Other]
offer	other	IG; by the way, anyone willing to part with wood?; Offer	[Other]
counteroffer	offer	amycharl; you got wheat?; Counteroffer	[Offer]
accept	offer	IG; yes; Accept	[Offer]
counteroffer	other	amycharl; give me two for a wood? give me two for a wood?; Counteroffer	[Other]
counteroffer	refusal	sabercat; I will give you wheat and ore for wood; Counteroffer	[Refusal]
accept	counteroffer	IG; harsh but alright; Accept	[Counteroffer]
offer	other	sabercat; can anyone trade wood?; Offer	[Other]
offer	offer	sabercat; for ore?; Offer	[Offer]
refusal	refusal	IG; sry; Refusal	[Refusal]
refusal	other	dmm; can't help you there i'm afraid; Refusal	[Other]
counteroffer	other	amycharl; you wanna do that ore and wheat for wood offer?; Counteroffer	[Other]
offer	other	sabercat; now you givee me wood?; Offer	[Other]
offer	offer	IG; That is I need ore  and have sheep and wheat to trade; Offer	[Offer]
refusal	offer	amycharl; nah; Refusal	[Offer]
offer	other	IG; or clay?; Offer	[Other]
offer	other	dmm; by the way, does anybody want a sheep?  i'm looking for one wood.; Offer	[Other]
refusal	offer	IG; sorryt; Refusal	[Offer]
refusal	other	sabercat; Nope,  no sheep; Refusal	[Other]
refusal	offer	amycharl; no; Refusal	[Offer]
counteroffer	offer	sabercat; both?; Counteroffer	[Offer]
accept	offer	IG; sure; Accept	[Offer]
accept	offer	sabercat; okay, thanks!; Accept	[Offer]
offer	accept	sabercat; wheat; Offer	[Accept]
accept	other	IG; sure; Accept	[Other]
accept	other	amycharl; yup; Accept	[Other]
counteroffer	other	IG; ill take wood; Counteroffer	[Other]
counteroffer	offer	amycharl; ill give you a couple; Counteroffer	[Offer]
counteroffer	offer	amycharl; ill take wheat; Counteroffer	[Offer]
offer	offer	dmm; i just need one; Offer	[Offer]
accept	offer	amycharl; sheep for a what is fine; Accept	[Offer]
refusal	offer	IG; nah; Refusal	[Offer]
refusal	other	sabercat; no; Refusal	[Other]
refusal	other	dmm; Nope,   i'm okay now; Refusal	[Other]
refusal	refusal	amycharl; no; Refusal	[Refusal]
refusal	other	sabercat; no wheat; Refusal	[Other]
offer	offer	amycharl; ?; Offer	[Offer]
refusal	other	IG; sry; Refusal	[Other]
counteroffer	offer	sabercat; for what?; Counteroffer	[Offer]
offer	other	amycharl; wheat preferably; Offer	[Other]
refusal	offer	sabercat; dont have that :D; Refusal	[Offer]
offer	other	amycharl; anything else is fine anything else is fine; Offer	[Other]
counteroffer	other	sabercat; wood?; Counteroffer	[Other]
accept	offer	amycharl; yer sure; Accept	[Offer]
accept	other	sabercat; then go ahead; Accept	[Other]
offer	counteroffer	amycharl; anyone up for that?; Offer	[Counteroffer]
refusal	other	IG; nah; Refusal	[Other]
refusal	other	sabercat; nope; Refusal	[Other]
offer	other	amycharl; or a wheat actually; Offer	[Other]
refusal	offer	dmm; i have neither i have neither; Refusal	[Offer]
refusal	offer	sabercat; (I would, but I have nothing...); Refusal	[Offer]
accept	counteroffer	amycharl; yup; Accept	Counteroffer
offer	other	sabercat; and can anyone give me ore for wheat?; Offer	[Other]
counteroffer	offer	amycharl; ill giv you ore for clay; Counteroffer	[Offer]
refusal	counteroffer	sabercat; if I had it...; Refusal	Counteroffer
refusal	offer	sabercat; nope, no ore...; Refusal	[Offer]
accept	counteroffer	sabercat; yep; Accept	[Counteroffer]
counteroffer	other	sabercat; wheat; Counteroffer	[Other]
offer	other	amycharl; no i mean i want to give a sheep no i mean i want to give a sheep; Offer	[Other]
counteroffer	offer	dmm; i have a wood; Counteroffer	[Offer]
counteroffer	offer	dmm; would that be enough for you?; Counteroffer	[Offer]
accept	other	IG; cheers; Accept	[Other]
refusal	other	IG; Ive got nothing...; Refusal	[Other]
refusal	other	dmm; so i'd like to hold onto it!; Refusal	[Other]
offer	other	sabercat; amy? do you have ore?; Offer	[Other]
counteroffer	offer	amycharl; i have one; Counteroffer	[Offer]
offer	other	sabercat; ore needed :D; Offer	[Other]
counteroffer	other	amycharl; if you gave me two of something; Counteroffer	[Other]
offer	offer	amycharl; ?; Offer	[Offer]
offer	other	amycharl; usual offer; Offer	[Other]
refusal	offer	IG; sorry; Refusal	[Offer]
refusal	other	dmm; i'm not needing sheep right now; Refusal	[Other]
refusal	other	amycharl; nope; Refusal	[Other]
refusal	other	dmm; nope; Refusal	[Other]
counteroffer	other	IG; what are you offering?; Counteroffer	[Other]
offer	offer	sabercat; how much do you have?; Offer	[Offer]
counteroffer	offer	IG; 1; Counteroffer	[Offer]
refusal	offer	IG; actually, sorry, im going to hang on to it; Refusal	[Offer]
offer	offer	sabercat; for wood or sheep?; Offer	[Offer]
refusal	offer	amycharl; i only have one and i want it, sorry; Refusal	[Offer]
accept	other	skinnylinny; I have...; Accept	[Other]
counteroffer	offer	skinnylinny; Trade you an ore for a clay?; Counteroffer	[Offer]
counteroffer	refusal	sabercat; will you trade for wood? no clay; Counteroffer	[Refusal]
refusal	offer	skinnylinny; Got wood, thanks; Refusal	[Offer]
refusal	offer	skinnylinny; Nope; Refusal	[Offer]
offer	other	sabercat; I got clay I got clay; Offer	[Other]
offer	other	sabercat; want to trade for the ore...; Offer	[Other]
accept	other	skinnylinny; Sure; Accept	[Other]
accept	offer	skinnylinny; Meanie!; Accept	[Offer]
accept	offer	skinnylinny; I can; Accept	[Offer]
accept	offer	sabercat; okay, for wood or sheep?; Accept	[Offer]
refusal	offer	skinnylinny; I have nothing at the moment :P; Refusal	[Offer]
offer	other	sabercat; so want sheep or wood?; Offer	[Other]
offer	other	amycharl; anyone want a sheep for some wood?; Offer	[Other]
refusal	other	skinnylinny; no thanks; Refusal	[Other]
offer	offer	amycharl; want some clay?; Offer	[Offer]
accept	counteroffer	skinnylinny; Please; Accept	[Counteroffer]
counteroffer	offer	skinnylinny; I only have ore to offer I only have ore to offer; Counteroffer	[Offer]
offer	other	amycharl; how much? how much?; Offer	[Other]
counteroffer	other	skinnylinny; I have four... But could do with other materials; Counteroffer	[Other]
offer	other	amycharl; well ill give you 3 clay for 3 ore; Offer	[Other]
accept	refusal	skinnylinny; Hmmm, sounds like a deal; Accept	[Refusal]
accept	offer	sabercat; yep, for what?; Accept	[Offer]
offer	offer	amycharl; clay preferably; Offer	[Offer]
refusal	offer	sabercat; no way; Refusal	[Offer]
counteroffer	other	amycharl; ore? ore?; Counteroffer	[Other]
accept	offer	sabercat; could be; Accept	[Offer]
accept	offer	skinnylinny; I have ore; Accept	[Offer]
accept	other	amycharl; me too me too; Accept	[Other]
offer	other	sabercat; want to trade for sheep? want to trade for sheep?; Offer	[Other]
refusal	other	skinnylinny; No thanks; Refusal	[Other]
counteroffer	other	amycharl; ill give an ore for two sheep; Counteroffer	[Other]
accept	refusal	sabercat; okay; Accept	[Refusal]
accept	other	skinnylinny; I do; Accept	[Other]
offer	other	sabercat; how much?; Offer	[Other]
accept	other	skinnylinny; one, what are you offering?; Accept	[Other]
offer	offer	sabercat; sheep?; Offer	[Offer]
counteroffer	offer	skinnylinny; hmmm, one sheep for a wood?; Counteroffer	[Offer]
accept	refusal	sabercat; yep; Accept	[Refusal]
accept	other	skinnylinny; Done; Accept	[Other]
offer	other	sabercat; anyone has clay?; Offer	[Other]
accept	offer	skinnylinny; Also, yes.; Accept	[Offer]
offer	other	sabercat; can you do for another sheep? or; Offer	[Other]
offer	offer	sabercat; two?; Offer	[Offer]
refusal	offer	skinnylinny; Ah, actually, I can't, sorry.; Refusal	[Offer]
refusal	other	skinnylinny; I kinda need it I kinda need it; Refusal	[Other]
refusal	refusal	skinnylinny; Um, nope.; Refusal	[Refusal]
offer	other	sabercat; anyone wants any number of sheep?; Offer	[Other]
offer	other	sabercat; anyone has clay?; Offer	[Other]
offer	offer	sabercat; to trade?; Offer	[Offer]
refusal	other	amycharl; nope; Refusal	[Other]
refusal	other	skinnylinny; Nope; Refusal	[Other]
offer	other	sabercat; anyone got ore?; Offer	[Other]
refusal	other	skinnylinny; Nope; Refusal	[Other]
refusal	offer	amycharl; nope; Refusal	[Offer]
refusal	other	sabercat; nope; Refusal	[Other]
refusal	offer	amycharl; nope; Refusal	[Offer]
accept	other	sabercat; got one; Accept	[Other]
counteroffer	refusal	amycharl; ill give you a wood for a clay?; Counteroffer	[Refusal]
accept	accept	sabercat; yes, skinny, I might when its my turn; Accept	[Accept]
counteroffer	other	amycharl; wud u rather wheat or wood? wud u rather wheat or wood? for a clay?; Counteroffer	[Other]
offer	other	sabercat; who wants clay for wheat?; Offer	[Other]
accept	other	skinnylinny; Me please; Accept	[Other]
offer	other	sabercat; amy?; Offer	[Other]
counteroffer	other	skinnylinny; One clay for one wheat; Counteroffer	[Other]
counteroffer	offer	skinnylinny; Or for an ore; Counteroffer	[Offer]
accept	offer	skinnylinny; Awesome, thanks thanks; Accept	[Offer]
accept	other	sabercat; no problem; Accept	[Other]
counteroffer	other	sabercat; can you trae ore skinny?; Counteroffer	[Other]
counteroffer	refusal	sabercat; for clay?; Counteroffer	[Refusal]
accept	offer	skinnylinny; I can...; Accept	[Offer]
counteroffer	other	skinnylinny; Not for clay; Counteroffer	[Other]
refusal	accept	skinnylinny; I don't have any, sorry; Refusal	[Accept]
accept	other	amycharl; sure; Accept	[Other]
offer	other	sabercat; skinny, got sheep?; Offer	[Other]
refusal	offer	skinnylinny; Nope; Refusal	[Offer]
offer	other	skinnylinny; sabercat: Got wood?; Offer	[Other]
refusal	offer	sabercat; nope; Refusal	[Offer]
accept	other	amycharl; yer; Accept	[Other]
offer	other	amycharl; anyone got a sheep?; Offer	[Other]
refusal	other	sabercat; nope; Refusal	[Other]
refusal	other	skinnylinny; Nope; Refusal	[Other]
offer	offer	amycharl; people got wood or clay?; Offer	[Offer]
refusal	offer	skinnylinny; Nope; Refusal	[Offer]
accept	other	sabercat; I got them, what are you offering?; Accept	[Other]
offer	other	amycharl; ore?; Offer	[Other]
refusal	other	sabercat; dont need that; Refusal	[Other]
offer	other	amycharl; you want a sheep?; Offer	[Other]
refusal	accept	sabercat; ah, forget it. you have nothing to offer; Refusal	[Accept]
offer	offer	amycharl; well what do you want?; Offer	[Offer]
refusal	offer	sabercat; nothing. I wont give it to you, because you are up to something evil; Refusal	[Offer]
accept	accept	amycharl; yup; Accept	[Accept]
offer	other	skinnylinny; Got any ore?; Offer	[Other]
counteroffer	other	amycharl; clay for an ore?; Counteroffer	[Other]
counteroffer	refusal	skinnylinny; Make it two?; Counteroffer	[Refusal]
refusal	counteroffer	amycharl; nah, ill just wait; Refusal	[Counteroffer]
accept	offer	skinnylinny; Yup; Accept	[Offer]
offer	other	sabercat; want ore?; Offer	[Other]
offer	other	sabercat; yes? no?; Offer	[Refusal] 
refusal	offer	skinnylinny; No thanks; Refusal	[Offer]
offer	other	sabercat; okay, how about two ores?; Offer	[Other]
refusal	refusal	skinnylinny; Nope; Refusal	[Refusal]
offer	other	sabercat; clay?; Offer	[Other]
offer	offer	sabercat; clay and ore?; Offer	[Offer]
refusal	other	skinnylinny; Nope, got them; Refusal	[Other]
offer	other	skinnylinny; Does anyone have any wood?; Offer	[Other]
refusal	offer	sabercat; no; Refusal	[Offer]
accept	other	skinnylinny; I can; Accept	[Other]
refusal	offer	amycharl; nope; Refusal	[Offer]
counteroffer	other	skinnylinny; How many sheep do you want?; Counteroffer	[Other]
offer	offer	sabercat; will you get two for an ore?; Offer	[Offer]
counteroffer	other	skinnylinny; I'd rather get two ore for two sheep; Counteroffer	[Other]
accept	other	sabercat; thanks; Accept	[Other]
offer	other	sabercat; anyone got clay?; Offer	[Other]
refusal	offer	skinnylinny; Sorry; Refusal	[Offer]
offer	other	yiin; i need wood; Offer	[Other]
refusal	offer	inca; not got wood, sorry; Refusal	[Offer]
counteroffer	offer	nareik15; I've got some wood; Counteroffer	[Offer]
offer	offer	yiin; you want to trade??; Offer	[Offer]
accept	other	nareik15; yeah sure; Accept	[Other]
refusal	offer	inca; not me,  sorry; Refusal	[Offer]
refusal	other	yiin; no clay... sry; Refusal	[Other]
refusal	offer	inca; nope, sorry; Refusal	[Offer]
counteroffer	other	yiin; i no need sheep  but i need ore or clay; Counteroffer	[Other]
refusal	other	nareik15; yeah, same here :); Refusal	[Other]
accept	offer	inca; i do,  what do you have?; Accept	[Offer]
accept	offer	yiin; i have but i need ore or clay; Accept	[Offer]
offer	offer	nareik15; I've sheep or wood; Offer	[Offer]
counteroffer	offer	inca; trade for wood?; Counteroffer	[Offer]
counteroffer	accept	yiin; same here; Counteroffer	[Accept]
refusal	offer	yiin; no sorry; Refusal	[Offer]
counteroffer	offer	inca; i have a clay, trade for sheep?; Counteroffer	[Offer]
accept	accept	nareik15; cool; Accept	[Accept]
accept	offer	yiin; i have; Accept	[Offer]
counteroffer	other	yiin; i need clay or ore; Counteroffer	[Other]
accept	offer	inca; ore it is then; Accept	[Offer]
counteroffer	offer	nareik15; don't have wheat to spare but plenty sheep or wood, I need clay or ore as well; Counteroffer	[Offer]
refusal	offer	inca; sorry; Refusal	[Offer]
counteroffer	offer	yiin; i got ore; Counteroffer	[Offer]
counteroffer	other	yiin; i need clay or wood; Counteroffer	[Other]
offer	offer	nareik15; I can give you some wood.; Offer	[Offer]
accept	offer	nareik15; thanks; Accept	[Offer]
refusal	other	inca; need mine, sorry; Refusal	[Other]
counteroffer	other	inca; i have clay, do you have wheat?; Counteroffer	[Other]
counteroffer	other	inca; i've got clay,  not wood; Counteroffer	[Other]
refusal	offer	inca; sorry, not here; Refusal	[Offer]
refusal	other	yiin; i need my clay sorry; Refusal	[Other]
accept	offer	inca; i do,  you got sheep?; Accept	[Offer]
accept	offer	nareik15; I do; Accept	[Offer]
accept	other	yiin; yes yes; Accept	[Other]
refusal	offer	inca; no sheep, sorry; Refusal	[Offer]
refusal	other	yiin; no sorry; Refusal	[Other]
refusal	offer	inca; not me, sorry; Refusal	[Offer]
refusal	offer	yiin; no sorry; Refusal	[Offer]
refusal	offer	yiin; no wood sorry; Refusal	[Offer]
refusal	other	nareik15; sorry; Refusal	[Other]
refusal	offer	inca; sorry, only got one; Refusal	[Offer]
counteroffer	offer	yiin; unless you have 2 woods, i cant trade my ore; Counteroffer	[Offer]
counteroffer	refusal	nareik15; how about 1 wood 1 sheep?; Counteroffer	[Refusal]
accept	refusal	yiin; yah sure; Accept	[Refusal]
counteroffer	offer	inca; i have clay, i'll trade for sheep; Counteroffer	[Offer]
accept	offer	yiin; oh ok sure; Accept	[Offer]
counteroffer	other	nareik15; I have wood. trade for wheat?; Counteroffer	[Other]
accept	accept	yiin; yah sure; Accept	[Accept]
accept	offer	inca; i do; Accept	[Offer]
counteroffer	other	inca; got ore or wood?; Counteroffer	[Other]
offer	offer	nareik15; wood; Offer	[Offer]
accept	other	inca; cool; Accept	[Other]
accept	offer	nareik15; yeah; Accept	[Offer]
offer	other	yiin; what do you need; Offer	[Other]
counteroffer	other	nareik15; do you have ore; Counteroffer	[Other]
refusal	other	yiin; no srry; Refusal	[Offer] 
refusal	other	inca; haha, i need the same i need the same; Refusal	[Other]
refusal	offer	inca; sorry; Refusal	[Offer]
refusal	offer	inca; nope, sorry; Refusal	[Offer]
refusal	other	yiin; no sorry; Refusal	[Other]
accept	offer	nareik15; yeah; Accept	[Offer]
offer	other	yiin; what do you need; Offer	[Other]
counteroffer	offer	nareik15; clay or ore; Counteroffer	[Offer]
accept	offer	yiin; thank you; Accept	[Offer]
accept	other	nareik15; thanks; Accept	[Other]
offer	other	inca; does anyone actually have any ore?; Offer	[Other]
offer	other	inca; i can give anything else for it; Offer	[Other]
refusal	offer	yiin; no  since 9 and 12 are seldom seen; Refusal	[Offer]
refusal	other	nareik15; I don't,  sorry; Refusal	[Other]
accept	offer	inca; i've got one; Accept	[Offer]
accept	offer	inca; i do,  have you got clay? have you got clay?; Accept	[Offer]
offer	offer	Carina; (to trade); Offer	[Offer]
refusal	offer	Gaeilgeoir; no, sorry; Refusal	[Offer]
accept	other	Carina; yes; Accept	[Other]
accept	other	inca; OK; Accept	[Other]
accept	offer	inca; Got one,  do you have clay? do you have clay?; Accept	[Offer]
accept	offer	Gaeilgeoir; yep; Accept	[Offer]
accept	other	inca; cool; Accept	[Other]
refusal	offer	inca; nope, sorry; Refusal	[Offer]
refusal	offer	Gaeilgeoir; sorry mate, no; Refusal	[Offer]
offer	offer	Gaeilgeoir; I have ore or clay; Offer	[Offer]
refusal	offer	inca; sorry, nope; Refusal	[Offer]
accept	other	Carina; I have wood; Accept	[Other]
counteroffer	offer	Carina; do you have wheat?; Counteroffer	[Offer]
refusal	offer	Gaeilgeoir; no, sorry :(; Refusal	[Offer]
refusal	offer	Carina; no; Refusal	[Offer]
offer	other	Gaeilgeoir; or wood?; Offer	[Other]
refusal	offer	inca; neither, sorry; Refusal	[Offer]
refusal	offer	inca; nope; Refusal	[Offer]
refusal	other	Gaeilgeoir; nope; Refusal	[Other]
refusal	other	inca; sorry, nope; Refusal	[Other]
refusal	other	nareik15; nope sorry; Refusal	[Other]
accept	offer	inca; i've got wood, trade for ore?; Accept	[Offer]
refusal	offer	yiin; nope sry; Refusal	[Offer]
accept	other	Gaeilgeoir; deal; Accept	[Other]
refusal	offer	inca; none, sorry; Refusal	[Offer]
refusal	offer	Gaeilgeoir; no, sorry; Refusal	[Offer]
refusal	other	yiin; no sry; Refusal	[Other]
counteroffer	other	inca; i'll trade for sheep?; Counteroffer	[Other]
accept	offer	yiin; yes thank you; Accept	[Offer]
counteroffer	other	nareik15; i'm ok for ore at the mo. could do with some wheat though if anyone has any; Counteroffer	[Other]
refusal	other	Gaeilgeoir; sorry, I'm no help; Refusal	[Other]
counteroffer	other	yiin; yes i also need wheat :) i also need wheat :); Counteroffer	[Other]
refusal	offer	inca; no wheat here, sorry; Refusal	[Offer]
offer	offer	inca; do you have wheat?; Offer	[Offer]
offer	other	nareik15; so was it wood you were after?; Offer	[Other]
counteroffer	other	yiin; wheat that i am after; Counteroffer	[Other]
counteroffer	offer	yiin; i mean i am after wheat; Counteroffer	[Offer]
accept	offer	nareik15; yeah; Accept	[Offer]
offer	other	Gaeilgeoir; Sorry, sheep; Offer	[Other]
counteroffer	other	yiin; i got ore; Counteroffer	[Offer] 
offer	offer	Gaeilgeoir; Anyone have sheep?; Offer	[Offer]
offer	offer	Gaeilgeoir; I can give ore or wheat; Offer	[Offer]
counteroffer	offer	nareik15; i've got sheep aswell; Counteroffer	[Offer]
offer	other	Gaeilgeoir; need ore or wheat?; Offer	[Other]
counteroffer	other	yiin; i need wheat; Counteroffer	[Other]
counteroffer	offer	nareik15; wheat; Counteroffer	[Offer]
offer	other	Gaeilgeoir; I'm definitely giving wheat; Offer	[Other]
refusal	offer	inca; i need mine, sorry; Refusal	[Offer]
refusal	other	nareik15; nope, looking for the same thing; Refusal	[Other]
refusal	offer	Gaeilgeoir; no sorry; Refusal	[Offer]
refusal	offer	yiin; no; Refusal	[Offer]
refusal	other	Gaeilgeoir; Sorry, I need wood too; Refusal	[Other]
counteroffer	other	Gaeilgeoir; I have wheat if you want; Counteroffer	[Other]
counteroffer	offer	inca; do you have wheat kieran? if so i can trade wood; Counteroffer	[Offer]
offer	other	nareik15; sorry, plenty of sheep though :); Offer	[Other]
accept	offer	inca; i'll trade sheep for wheat; Accept	[Offer]
accept	offer	nareik15; me too me too; Accept	[Offer]
accept	other	Gaeilgeoir; deal; Accept	[Other]
offer	offer	Gaeilgeoir; I have wheat and wood; Offer	[Offer]
refusal	offer	yiin; no sorry; Refusal	[Offer]
refusal	other	inca; not any more, sorry; Refusal	[Other]
refusal	other	nareik15; nope, no clay; Refusal	[Other]
offer	other	nareik15; i'm guessing nobody has any clay?; Offer	[Other]
refusal	offer	Gaeilgeoir; Not me anyway; Refusal	[Offer]
refusal	other	inca; sorry, nope; Refusal	[Other]
offer	other	inca; anyone got sheep? I can give anything but clay; Offer	[Other]
